central perk|phoebe|dejected hi, you guys.
central perk|chandler|hey
central perk|monica|hi
central perk|rachel|whats the matter
central perk|phoebe|well its justits one of those situations that i just hate. yknow a massage client gave me three tickets to the helmetpelts exhibit at the morgan chase museum.
central perk|joey|nodding knowingly now youre thinking you gotta sleep with him.
central perk|phoebe|no no its just that he gave me three tickets and there are six of us
central perk|chandler|ill give up my ticket.
central perk|joey|me too.
central perk|phoebe|okay thats so generous
central perk|chandler|and i think ross is generous too.
central perk|phoebe|great okay then its just us girls 
central perk|monica and rachel|less than enthused great.
central perk|phoebe|yeah.
central perk|rachel|so whatwhat is the exhibit.
central perk|phoebe|its mostly just photographs of lesbian love scenes interspersed with video games and free sandwiches.
central perk|joey|oh man hits chandler
central perk|ross|entering hey
central perk|rachel|hi
central perk|chandler|hey
central perk|joey|hey ross listen chandler got you out of going to the lesbian sandwich museum this weekend
central perk|ross|thanks but i have plans elizabeth and i are going out of town.
central perk|monica|oh thats great
central perk|ross|yeah.
central perk|monica|i mean think about all the money that youre gonna make
central perk|ross|why what
central perk|monica|well, her father pays you for babysitting right
central perk|ross|no, no, thats funny. but maybe its time to move on, let it go, yknow stop it besides, rachel is going out with elizabeths father, so ah, hes much older than she is. looks like im not the only one interested in fossils, huh
central perk|rachel|i mean ross all that does is remind us that you are interested in fossils.
central perk|ross|okay, okay. uh, well uh, rachel is going to need to yell sweet nothings paul enters in his ear.  and walks up right behind ross, and standard sitcom joke 2b follows with the person being insulted standing right behind the person doing the insulting while the rest of the people become frightened and try to warn the insulter about the insultees presence.
central perk|chandler|ross.
central perk|ross|oh, come on you guys thats funny yknow because hes needhes got like a hearing aide yknow, causecause yknow, cause hes all old, and  paul reveals his presence by laughing, thus concluding standard sitcom joke 2b. paul then pulls ross aside to have a little chat with him and tells the rest of the group that hell just be one second.
central perk|paul|okay look, ross, just so you know that since lizzie likes you so much, ive decided to accept the fact that youre going out with her.
central perk|ross|really that okay, thats great.
central perk|paul|yeah. but then i changed my mind. im funny like that. so i told lizzie, now im telling you, i dont want you seeing my daughter anymore.
central perk|ross|all right look, ii realize it upsets you.
central perk|paul|yes it does.
central perk|ross|but, elizabeth and i areare both adults and so i dont think theres really anything you can do about it.
central perk|paul|ill call the university and tell them about your relationship and have you fired.
a dry cleaners|ross|ohh a man with a plan opening credits back amongst the other celebrities hanging on the walls.]
a dry cleaners|phoebe|oh, this is so exciting you get your picture back up on the wall of fame eek
a dry cleaners|joey|i know. it was so cool when i was up there before. me and jim belushi would just be crackin up about something then i get fired off of days of our lives and he takes me down. now hes just laughing at me. look at him, that smug belushi bastard, ill
a dry cleaners|phoebe|gasps ohh, okay maybe they put your picture back up they can put you next to matt lauer. look at him, smiling at me. giggles yeah i know wed be great together the dry cleaner finishes with the customer in front of joey and they approach the counter.
a dry cleaners|joey|hey so im back.
a dry cleaners|the dry cleaner|who are you
a dry cleaners|joey|joey tribbiani from the wall the dry cleaner doesnt remember okay, maybe this will jog your memory, huh holds his picture up in front of his face. huh okay ehahanyway, im ready to go back up on the wall im the star of a new tv show.
a dry cleaners|the dry cleaner|picking up a tv guide show me in the table.
a dry cleaners|joey|oh well, its not on tv yet.
a dry cleaners|the dry cleaner|well, then its not on the wall yet.
a dry cleaners|joey|okay, fine, i will bring you a tape, huh walks away
the morgan chase museum|phoebe|so umm, now do you have any of matt lauers clothes here maybe just ones that havent been cleaned yet  the dry cleaner just stares at her and she retreats.
the morgan chase museum|monica|oh, i love museums
the morgan chase museum|rachel|umm.
the morgan chase museum|monica|soakin up all the culture.
the morgan chase museum|rachel|yeah.
the morgan chase museum|monica|where do you want to start
the morgan chase museum|rachel|ooh, the gift shop
the morgan chase museum|monica|yeah
the morgan chase museum|phoebe|hey, and then lunch.
the morgan chase museum|rachel|oh, wait yes, but i cant eat too much. paul is taking me out to dinner tonight, he said he has a big surprise planned.
the morgan chase museum|phoebe|oh wow. what, do you think maybe hes gonna tell you that hes gay
the morgan chase museum|rachel|what no why
the morgan chase museum|phoebe|no reason that would just be a really big surprise, right a museum official enters with another man and woman.
the morgan chase museum|the museum official|to the couple you can put the aisle over here points, and put the wedding ceremony right over here. points.
the morgan chase museum|rachel|i didnt know you could get married here.
the morgan chase museum|monica|this would be a beautiful place to get married, yeah, but i wouldnt put the aisle there and i would never have the ceremony there points to both places. i mean youd have the ceremony under this big beautiful arch. the arch at the entrance to the room. 
the morgan chase museum|the museum official|to monica may i help you
the morgan chase museum|rachel|oh sorry didnt mean to interrupt. its just such a beautiful space do you do a lot of weddings here
the morgan chase museum|the museum official|yes. were very popular. theres a twoyear waiting list. sorry she kinda storms out with the couple.
the morgan chase museum|rachel|monica, you should totally put your name down on the list
the morgan chase museum|monica|what are you crazy im not getting married im not even engaged.
the morgan chase museum|phoebe|yeah, but theres a twoyear wait. and then what if you get engaged in two years and then you got to wait another two years for this place. thats four years. chandlers not gonna wait that long. hes gonna find somebody else, yknow someone, someone who did put their name on the list. rachel agrees.
the morgan chase museum|rachel|yeah hon, it cant hurt to put your name down i mean in if two years if youre not engaged you just dont use it.
the morgan chase museum|monica|well, i mean i guess there is no harm in putting my name down.
the morgan chase museum|rachel|im gonna do it too
the morgan chase museum|phoebe|me too
the morgan chase museum|rachel|really who would, who would you marry
the morgan chase museum|phoebe|i dont know, i dont have anyone right now. yknow
the morgan chase museum|rachel|oh pheebs.
the morgan chase museum|phoebe|dont feel too sorry for me. at least my boyfriend isnt gay.
the morgan chase museum|monica|phoebe, that stuff is
the dry cleaners|phoebe|dont even get me started on yours
the dry cleaners|joey|entering hey so, did you watch the tape of my show
the dry cleaners|the dry cleaner|i did.
the dry cleaners|joey|all right, lets get me back up there holds out his picture.
the dry cleaners|the dry cleaner|no it dont go up on the wall
the dry cleaners|joey|whatbut you saw the show
the dry cleaners|the dry cleaner|yes, it was very offensive to my people
the dry cleaners|joey|dry cleaners
the dry cleaners|the dry cleaner|russians it showed them as terrorists and villains
the dry cleaners|joey|okay okay, look youyouyou got harrison ford up there
the dry cleaners|the dry cleaner|thats right. mr. ford is a very good customer, he brings us a lot of clothes you bring us nothing
the dry cleaners|joey|okay well that may be true. but, inin okay, air force one the russians were terrorists and evil and plus he kills a bunch of them thatthatthats offensive to russians.
the dry cleaners|the dry cleaner|ive never seen it
a cabin in the woods|joey|oh you should, its great. the dry cleaner stares at him and joey retreats.
a cabin in the woods|ross|this place is really beautiful
a cabin in the woods|elizabeth|yeah, ive been coming here since i was a kid. this used to be my grandmas.
a cabin in the woods|ross|wow the only thing i got from my grandmother was her eyes. i mean notnot her actual eyeballs, but, but people say that my eyesdodo you want to make out
a cabin in the woods|elizabeth|sure they fall to the couch and start to make out, but ross stops suddenly.
a cabin in the woods|elizabeth|are you okay whats wrong
a cabin in the woods|ross|ehh, i was just, i was just thinking about your father.
a cabin in the woods|elizabeth|well, whatever works for ya
a cabin in the woods|ross|no. nono uh, he just, he just really freaked me out before.
a cabin in the woods|elizabeth|oh. well, so we have to hide our relationship from one more person. big deal. besides, its kinda fun hiding.
a cabin in the woods|ross|yeah. they start making out again.
a cabin in the woods|elizabeth|quietly hey umm, you brought protection right
a cabin in the woods|ross|loudly why are there like bears or something looks around and then sees that elizabeth is shaking her head no and realizes what elizabeth meant. ohh. oh, protection. yeahno, yeahno, thatthatthat i forgot.
a cabin in the woods|elizabeth|ill just run to the store and get some.
a cabin in the woods|ross|oh no heyhey, im the guy ill get it.
a cabin in the woods|elizabeth|do you know where the store is
a cabin in the woods|ross|no.
a cabin in the woods|elizabeth|do you want to ride around town on my little pink bicycle 
a cabin in the woods|ross|a little bit.
a cabin in the woods|elizabeth|laughs ill be back in ten minutes.
a cabin in the woods|ross|okay.
a cabin in the woods|elizabeth|why dont you get in the hot tub and ill meet you there.
a cabin in the woods|ross|ohh, okay. elizabeth leaves and ross starts to remove his clothing right there in the middle of the living room where someone can see him. of course, someone almost does, but he hears a door opening and
a cabin in the woods|rachel|from another room oh my god, what a great surprise this is such a beautiful house. ross with his pants around his ankles tries to run, but dr. geller forgets that he has his pants around his ankles and falls down trying to flee.
monica|paul|to rachel thank you, its my moms. so this is the kitchen. dr. geller, the man with the ph.d. in paleontology, is trying to find a place to hide, but this supposedly intelligent man in the hands of clichd scriptwriters runs around with his pants down around his ankles like one of the three stooges. rings. he lets the machine answer it.]
monica|chandler|on machine youve reached monica and chandlers, if youre listening to this message, were probably screening. to himself yeah we are.
monica|the museum official|on phone hi, this is heldi from the morgan chase museum. im calling for monica geller. i want to let her know that there was a cancellation and if shes still interested in having the binggeller wedding at our facility, it is available chandler runs to answer the phone.
pauls cabin|chandler|on phone this is chandler bing this is chandler bing listens yes, the groomno not the groom commercial break talking.]
pauls cabin|rachel|its so secluded up here.
pauls cabin|paul|i know. i like it up here.
pauls cabin|rachel|i feel like were the only two people in the world. she sets down her wine class, picks up a walnut, and knocks another one on the floor. oops. sorry. she reaches down to pick it up and ross hands it to her. ross is hiding under the couch and causes rachel to scream.
pauls cabin|paul|whats the matter honey did you see a little mouse
pauls cabin|rachel|nono big bear big bear outside i think iiwould youactually, would you go check on that
pauls cabin|paul|honey, we dont have any bears here.
pauls cabin|rachel|well, okay. wouldwould you get me a diet coke
pauls cabin|paul|okay. ill be right back. gets up and heads for the kitchen.
pauls cabin|rachel|okay. after paul leaves rachel drops to the floor to confront ross. what what are you doing here
pauls cabin|ross|what are you doing here
pauls cabin|rachel|i came with paul
pauls cabin|ross|yeah, i recognize the ankles
pauls cabin|rachel|get up
pauls cabin|paul|entering here you go honey rachel kicks ross back under the couch.
pauls cabin|rachel|ahh. thank you
pauls cabin|paul|diet coke. hands her the glass.
pauls cabin|rachel|op, ice. i need ice.
pauls cabin|paul|okay.
pauls cabin|rachel|thank you.
pauls cabin|paul|ill be right back. he goes to get the ice.
pauls cabin|ross|under the couch you and your ice.
pauls cabin|rachel|ugh get out get out go come on ross gets up and heads for the kitchen. no not in there hes in there she points ross to the door next to the kitchen.
pauls cabin|ross|before entering did you really hear a bear
pauls cabin|rachel|gogo
pauls cabin|paul|entering here you go honey. one diet coke with ice.
pauls cabin|rachel|ohh, thank you.
pauls cabin|paul|im so happy that youre here.
pauls cabin|elizabeth|entering here i am
pauls cabin|paul|jumping up elizabeth oh look, elizabeths here who are you talking to
pauls cabin|elizabeth|uh, you guys
pauls cabin|paul|how did you know we were here
pauls cabin|elizabeth|umm
pauls cabin|rachel|well, sheshe obobviously saw the tire tracks that were leading up to the closed garage.
pauls cabin|elizabeth|obviously.
pauls cabin|paul|elizabeth, what are you doing here motions that he brought rachel here to be alone with her.
pauls cabin|rachel|diddid you come up here to work on that term paper or something
pauls cabin|elizabeth|yeah yep.
pauls cabin|rachel|well, why do yknow go in that room points to the room ross is in and do your homework
pauls cabin|elizabeth|ohh, i wouldnt do it in there. thats my dads bedroom.
pauls cabin|rachel|thats your, thats your dads bedroom. yelling thats your dads bedroom
pauls cabin|paul|why are you yelling
monica|rachel|whoa, that diet coke just went straight to my head woo staring at the phone as monica enters.]
monica|monica|hi, honey.
monica|chandler|gets up see you later. starts to leave.
monica|monica|what ii bought groceries, i was gonna make you dinner
monica|chandler|angrily well next time ask or at least wait for me to ask he storms out. monica puts the groceries down and goes to check the answering machine and hears.
monica|the museum official|on machine hi, this is heldi from the morgan chase museum. im calling for monica geller. 
monica|monica|oh no
monica|the museum official|on machine i want to let her know that there was a cancellation and if shes still interested in having the binggeller wedding at our facility, it is available
monica|monica|oh please, he didnt hear it he didnt hear it
monica|chandler|on machine this is chandler bing this is chandler bing the machine beeps off.
the dry cleaners|monica|noooo  attempt to get his picture on the wall, but the dry cleaner isnt working right now. instead, a beautiful woman is working.]
the dry cleaners|female clerk|can i help you
the dry cleaners|joey|uh yeah, wherewheres the guy who decides whos pictures go up on the wall
the dry cleaners|female clerk|hes not here right now.
the dry cleaners|joey|oh, youre kidding me allall right, well make sure you tell him that joey tribbiani stopped by to drop off all of these clothes. okay im an actor im kinda getting my picture up there on the wall.
the dry cleaners|female clerk|yknow, there are two people who could put your picture up there. she makes eyes at him.
pauls cabin|joey|oh really well, maybe you and i go out for drinks pause youre the other one right she thinks about it for a second and nods yes.
pauls cabin|paul|so lizzie, areareare you planning on staying the night
pauls cabin|elizabeth|oh nono believe me, im leaving as soon as possible
pauls cabin|paul|good. good. not that we dont want you to stay, obviously youre welcomehow much more homework do you have
pauls cabin|elizabeth|ahh, i just have one problem left that i do not know how to solve. uhh, rachel maybe you want to come upstairs and help me figure it out
pauls cabin|rachel|really okay. okay, iill go upstairs. to paul ifif you get me something from the car.
pauls cabin|paul|what do you need from the car
pauls cabin|rachel|surprise me.
pauls cabin|paul|whispering okay. starts for the car.
pauls cabin|rachel|yelling so youre gonna be in the car, i will be upstairs, and thats where everybodys gonna be rachel and elizabeth go upstairs. paul starts for the car, but notices his luggage is still out and decides to take in into the bedroom. [cut to his bedroom, ross is listening at the door as paul opens the door, trapping ross behind it. with pauls back turned ross coils up like a snake and slitters underneath the bed.]
central perk|paul|standing in front of a mirror and to himself just relax. just relax paul, youre doing great. ross moves a piece of luggage over so he can watch paul. she likes you. she maybe, she likes you. she likes you. yknow why because youre a pause neat guy. ross cant believe what hes hearing. you are the man. you are pause the man he opens his shirt and looks at his chest. i still got it. nice and sexy. youre just a love machine. starts singing im just a love machine and i wont work for nobody but you hey baby flexes and grunts loudly. showtime. starts to leave and starts singing. im just a love machine, yeah baby grunts again and ross is stunned.
central perk|monica|phoebe
central perk|phoebe|yeah
central perk|monica|have you seen chandler
central perk|phoebe|no why
central perk|monica|the woman from the museum called and said that there was a cancellation and that we could move up our wedding and chandler heard phoebe gasps. i know how bad is this
central perk|phoebe|well for the regular guy, its bad, but chandler, oh dear god
central perk|monica|i know i know and he totally freaked out and i cant find him anywhere
central perk|phoebe|what are you gonna do
central perk|monica|well, im never gonna listen to you again, thats for sure mimicking her. yknow, harm can it do if you go and put your name down
central perk|phoebe|rachel said that
the dry cleaners|monica|well rachels not here runs out. on the wall.]
the dry cleaners|phoebe|oh here it is noticing it next to the door. ooh, joey why did you sign it, son of a bitch son of a bitch is written across the entire picture.
the dry cleaners|joey|i didnt do that who wouldve done that
the dry cleaners|the dry cleaner|entering son of a bitch
the dry cleaners|phoebe|okay, maybe ask this guy.
the dry cleaners|the dry cleaner|you, get out of my shop
the dry cleaners|phoebe|well, what did he do
the dry cleaners|the dry cleaner|he went out with my wife
the dry cleaners|phoebe|joey
the dry cleaners|joey|whoawhoawhoawhoa, iihey i did not go out with your wife the same woman from before enters. okay i went out with her points at her.
the dry cleaners|the dry cleaner|thats my wife get out starts yelling at him in russian, and im betting hes not saying pleasant things about him.
the dry cleaners|phoebe|well, we should go.
pauls bedroom|joey|yeah.
pauls bedroom|elizabeth|ross ross
pauls bedroom|ross|elizabeth he opens one of the bed stands that he has curled himself up into. okay. okay. she helps him out. im gonna go out this window. points to the window next to him. ill meet you at the front door. just tell them youre going home, okay
pauls bedroom|elizabeth|okay
pauls bedroom|rachel|yelling from the living room oh waitwaitwait no dont go in there dont go in there i need another soda ross frantically starts to open the window as paul enters and traps him halfway out the window.
pauls bedroom|paul|ross
pauls bedroom|rachel|oh my god ross what in heavens name are you doing here
pauls bedroom|ross|to elizabeth and that is why we cannot see each other anymore.
pauls bedroom|paul|ross. you and i are going to have to have a little talk.
pauls bedroom|elizabeth|daddy
pauls bedroom|paul|youre next
pauls bedroom|elizabeth|okay. i didnt know he was here. runs over to rachel.
pauls bedroom|paul|let me just see if i got this straight. i tell you to stay away from my daughter or ill have you fired. what you heard was, take my daughter, come up to my country house, and ruin my weekend with rachel
pauls bedroom|ross|okay, pleaseplease paul, just let me explain
pauls bedroom|paul|no, let me explain fired
pauls bedroom|ross|all right, fine fine have me fired but uh, i want you to know that you and i are not all that different. i mean, i too am a neat guy. paul just looks at him.
pauls bedroom|paul|panicked what 
pauls bedroom|ross|and i too am just a love machine. hums a little bit and mimics pauls flexing.
monica|paul|ross, let me show you where the guest room is. return. chandler enters.]
monica|monica|going over to him im so sorry. please, stop freaking out.
monica|chandler|im not freaking out. why would i be freaking out a woman named heldi called and said we were getting married, but that happens everyday. does one of those chandler noises.
monica|monica|honey, we were at this beautiful place, and iii just put our names down for fun i mean, whats the harm in that
monica|chandler|right here clucks like a chicken for some reason.
monica|monica|chandler, please dont think i was trying to pressure you. phoebe and rachel
monica|chandler|phoebe and rachel so the people that knew about our wedding before me were you, phoebe and rachel, heldi, and apparently some band called starlight magic 7 who are available by the way
monica|monica|it was a mistake. please dont take this to mean anything, because it doesnt.
monica|chandler|okay.
monica|monica|really
monica|chandler|yes, if it really doesnt mean anything, because you know that im just not ready
monica|monica|i know i know.
monica|chandler|okay. they hug.
monica|monica|im gonna go tell joey that laughs that youre back. i was really worried about you. exits.
monica|phoebe|entering from her room hey, did she buy it
monica|chandler|totally.
monica|phoebe|so did heldi show you the place
monica|chandler|yeah, its beautiful.
monica|phoebe|i cant believe youre gonna ask monica to marry you
central perk|chandler|i know. they hug. ending credits
central perk|joey|hey gunther.
central perk|gunther|hey take these cappuccinos to table 11 and that guy over there points wants the biscotti. 
central perk|joey|oh uh, well i just came in for a cup of coffee to go.
central perk|gunther|do you still work here
central perk|joey|no no, i quit a long time ago. pause did i forget to you that one im sorry.
central perk|gunther|oh thats cool, i was gonna fire you anyway.
