chandler and joeys|monica|quietly hi
chandler and joeys|chandler|quietly hi they both start kissing. joey enters and chandler pushes her away.
chandler and joeys|joey|monica what time is it
chandler and joeys|chandler|uhh, 9. he pushes the clock into the sink.
chandler and joeys|joey|but its dark out.
chandler and joeys|monica|well thats because you always sleep to noon, silly this is what 9 looks like.
chandler and joeys|joey|i guess ill get washed up then. watch that sunrise. he goes into the bathroom.
chandler and joeys|monica|im really getting tired of sneaking around.
chandler and joeys|chandler|i know, me too. hey yknow what if we went away for a whole weekend yknow wed have no interruptions and we could be naked the entire time.
chandler and joeys|monica|all weekend thats a whole lotta naked.
chandler and joeys|chandler|yeah, i can say that i have a conference and you can say you have a chef thing.
chandler and joeys|monica|ohh, ive always wanted to go to this culinary fair that they have in jersey
chandler and joeys|chandler|okay, yknow your not though. lets go. he starts for his bedroom.
monica and rachels|monica|wait what about joey chandler opens the bathroom door to reveal joey passed out on the toilet with a toothbrush in his mouth. opening credits breakfast.]
monica and rachels|monica|entering from her room hey, guess what im doing this weekend im going to this culinary fair in new jersey.
monica and rachels|phoebe|oh weird, chandler just told us hes got a conference there
monica and rachels|monica|oh now thatthatthats funny, it seems like chandlers conference couldve been in connecticut or vermont.
monica and rachels|chandler|im not in charge of where the conference is held. do you want people to think its a fake conference its a real conference.
monica and rachels|ross|entering hey.
monica and rachels|joey|hey
monica and rachels|monica|hey.
monica and rachels|ross|is rachel here i gotta talk to her.
monica and rachels|monica|no, shes out shopping.
monica and rachels|ross|damn
monica and rachels|chandler|whats going on
monica and rachels|ross|i told emily to come. and i just need to yknow, talk to rachel about it.
monica and rachels|phoebe|wait a minute so when emily comes youre just, youre not gonna see rachel anymore
monica and rachels|ross|well look, im just trying to focus on the i get to see my wife, part, all right and not the part that makes me do this. he takes a big swig of pepto bismol.
monica and rachels|monica|wow, so you guys are, youre never gonna be in the same room together how is that even gonna work
monica and rachels|ross|i have no idea. i mean butbut i assure you i will figure it out. they all reflect briefly on what was said.
monica and rachels|joey|doesnt seem like its going to work, i mean
monica and rachels|rachel|entering hi, guys
monica and rachels|joey|hi
monica and rachels|chandler|uh, hey
monica and rachels|rachel|whats going on
monica and rachels|chandler|were flipping monicas mattress.
monica and rachels|joey|so im thinking, basically we pick it up and then we flip it.
monica and rachels|phoebe|yeah thats better than my way. they all agree and head to monicas room.
monica and rachels|rachel|oh okay, hey guys, would you flip mine too
monica and rachels|chandler|aww, man they go into monicas room.
monica and rachels|rachel|going through the mail oh look a letter from my mom.
monica and rachels|ross|so, rach, yknowyknow how emilys coming right
monica and rachels|rachel|oh yeah i know. [cut to monicas bedroom, chandler is trying to listen through the door.]
monica and rachels|phoebe|to chandler can you hear anything
monica and rachels|chandler|oh yes, somebody just said, can you hear anything joey is bent over at the waist and is looking for something under monicas bed.
monica and rachels|monica|hey, joeys ass what are you doing
monica and rachels|joey|holding a box well, remember when they got in that big fight and broke up and we were all stuck in her with no food or anything well, when ross said rachel at the wedding, i figured it was gonna happen again, so i hid this in here.
monica and rachels|monica|ooh, candy bars, crossword puzzles
monica and rachels|phoebe|ooh, madlibs, mine grabs it.
monica and rachels|chandler|condoms
monica and rachels|joey|you dont know how long were gonna be in here we may have to repopulate the earth.
monica and rachels|chandler|and condoms are the way to do that [cut to the living room.]
monica and rachels|ross|anyway itit kindait all boils down to this, the last time i talked to emily
monica and rachels|rachel|interrupting oh my god my dog died
monica and rachels|ross|what
monica and rachels|rachel|oh my god, le poo, our dog
monica and rachels|ross|le poos still alive
monica and rachels|rachel|oh god, it says he was hit by an ice cream truck and dragged for nineturns over the noteteen blocks. oh. they all come out from monicas bedroom oh my god.
monica and rachels|monica|sweetie, we heard you crying. please dont cry.
monica and rachels|rachel|its le poo.
atlantic city|phoebe|i know its le poo right now, but itll get better. of sex, sex, nothing but sex.]
atlantic city|chandler|jumping on the bed i cant believe it were here
atlantic city|monica|ooh, chocolates on the pillows i love that
atlantic city|chandler|oh, you should live with joey, rollos everywhere.
atlantic city|monica|come here. he does, and they kiss. okay, be right back.  goes to the bathroom and chandler turns on the tv and finds a highspeed police chase.
atlantic city|chandler|oh yes monica, get in here theres a highspeed car chase on monica returns, carrying a glass.
atlantic city|monica|were switching rooms.
atlantic city|chandler|looks at what shes holding and shies away oh dear god, they gave us glasses
atlantic city|monica|no, they gave us glasses with lipstick on them i mean, if they didnt change the glasses, who knows what else they didnt change. he glares at her. come on sweetie, i just want this weekend to be perfect, i mean we can change rooms, cant we
central perk|chandler|okay, but lets do it now though, because chopper 5 just lost its feed he grabs their bags and sprints out.
central perk|ross|hey, so uh, yknow how theres something i wanted to talk to you about
central perk|rachel|oh yeah turns to face him.
central perk|ross|well, yknow how im trying to work things out with emily. well, theres this one thing okay, rachel has her back turned to the camera, and ross isnt looking at her. here goes. i made a promise thatthey cut to the other camera and ross notices something coming out of rachels noseoh hey
central perk|rachel|what
central perk|ross|youre nose is bleeding
central perk|rachel|oh god. he hands her some tissues. no oh not again wiping her nose. thisthis happened when my grandfather died. its ugh sorry. she puts her head back. oh, okay, so im sorry, whatwhat were youwhat did you want to tell me
central perk|ross|umm rachel blows her nose.
central perk|rachel|sorry. sorry.
central perk|ross|okay, i uh, i cant see you anymore.
chandler and monicas weekend|rachel|yeah, i know. its ridiculous i cant see you either.
chandler and monicas weekend|hotel clerk|i think youll find this room more to your liking.
chandler and monicas weekend|chandler|okay, great. he grabs the remote and turns on the tv to the chase.
chandler and monicas weekend|hotel clerk|watching the chase they say hes only got half a tank left.
chandler and monicas weekend|chandler|half a tank we still got a lot of highspeed chasing to do
chandler and monicas weekend|monica|were switching rooms again.
chandler and monicas weekend|chandler|what why
chandler and monicas weekend|monica|this is a garden view room, and we paid for an ocean view room.
chandler and monicas weekend|hotel clerk|our last ocean view room was unacceptable to you.
chandler and monicas weekend|monica|to chandler excuse me, umm, can i talk to you over here for just a second
chandler and monicas weekend|chandler|uhhuh. he doesnt take his eyes off the tv.
chandler and monicas weekend|monica|chandler
chandler and monicas weekend|chandler|turning to face her yeah.
chandler and monicas weekend|monica|look, these clowns are trying to take us for a ride and im not gonna let em and were not a couple of suckers
chandler and monicas weekend|chandler|i hear ya, mugsy but look, all these rooms are fine okay can you just pick one so i can watchrealizeshave a perfect, magical weekend together with you. [time lapse, monica and chandler have changed rooms yet again.]
chandler and monicas weekend|monica|okay, this one i like
chandler and monicas weekend|chandler|watching tv, in fact, er is on. nothing its over dammit this is regularly scheduled programming
chandler and monicas weekend|monica|can we turn the tv off okay do we really want to spend the entire weekend like this
chandler and monicas weekend|chandler|oh, im sorry, am i getting in the way of all the room switching fun
chandler and monicas weekend|monica|hey, dont blame me for wigging tonight
chandler and monicas weekend|chandler|oh, who should i blame the nice bell man who had to drag out luggage to 10 different rooms
chandler and monicas weekend|monica|i dont know, how about the idiot who thought he could drive from albany to canada on a half a tank of gas
chandler and monicas weekend|chandler|do not speak ill of the dead.
chandler and monicas weekend|monica|were supposed to uh, be spending a romantic weekend together, itit, what is the matter with you
chandler and monicas weekend|chandler|i just want to watch a little television. what is the big deal geez, relax mom.
chandler and monicas weekend|monica|what did you say
monica and rachels|chandler|i said, geez, relax monnnnn. her nose in an attempt to stop the bleeding and as she hears ross enter, she quickly hides her face behind the magazine and removes the tissues.]
monica and rachels|rachel|hi
monica and rachels|ross|hey. rachel, iiive been wanting to tell you something for a while now and i really, i just have to get it out.
monica and rachels|rachel|okay, whats up
monica and rachels|ross|okay, yknow how you told me i should do whatever it takes to fix my marriage
monica and rachels|rachel|yeah, i told you to give emily whatever she wants.
monica and rachels|ross|and while that was good advice, you should know that whatwhat she wants 
monica and rachels|rachel|yeah
monica and rachels|ross|is for me not to see you anymore.
monica and rachels|rachel|thats crazy you cant do that what are you going to tell her pause realizes oh god. ohh, you already agreed to this, havent you
monica and rachels|ross|its awful i know, i mean, i feel terrible but i have to do this if i want my marriage to work. and i do, i have to make this marriage work. i have too. but the good thing is we can still see each other until she gets here.
monica and rachels|rachel|ohh lucky me oh my god that is good news, ross i think thats the best news ive heard since le poo died
monica and rachels|ross|you have no idea what a nightmare this has been. this is so hard.
monica and rachels|rachel|oh yeah, really is it ross yeah okay, well let me make this a just a little bit easier for you.
monica and rachels|ross|what are you doing
monica and rachels|rachel|storming out
monica and rachels|ross|rachel, this is your apartment.
chandler and joeys|rachel|yeah, well thats how mad i am commercial break throws his bag down and sits down on one of the leather chairs, but he sits on something and picks it up and throws it away.]
chandler and joeys|chandler|damn rollos
chandler and joeys|joey|hey, youre back
chandler and joeys|chandler|hey.
chandler and joeys|joey|how was your conference
chandler and joeys|chandler|it was terrible. i fought with pause my colleagues yknow, the entire time. are you kidding with this throws away another rollo
chandler and joeys|joey|oh, so your weekend was a total bust
chandler and joeys|chandler|uh, no, i got to see donald trump waiting for an elevator.
chandler and joeys|monica|entering hi
chandler and joeys|joey|hey, youre back too
chandler and joeys|monica|yeah. umm, chandler can i talk to you outside for a second
chandler and joeys|joey|hey, how was your chef thing
chandler and joeys|monica|oh, it was awful. to chandler i guess some people just dont appreciate really good food.
chandler and joeys|chandler|well, maybe it was the kind of food that tasted good at first but then made everybody vomit and have diarrhea.
chandler and joeys|monica|chandler motions for him to come outside.
chandler and joeys|chandler|monica. follows her out. [in the hall.]
chandler and joeys|monica|okay, id like to know how much the room was because id like to pay my half.
chandler and joeys|chandler|okay, fine, 300.
chandler and joeys|monica|300 dollars
chandler and joeys|chandler|yeah, just think of it as 25 per room
chandler and joeys|monica|urghh
chandler and joeys|joey|sticking his head out the door what are you guys woofing about
chandler and joeys|monica|chandler stole a twenty from my purse
central perk|joey|nooooo yknow what now that i think about it, i constantly find myself without twenties and you always have lots minus rachel is there as well.]
central perk|ross|you shouldve seen the look on her face. i dont want rachel to hate me i dont know what to do.
central perk|joey|you want my advice
central perk|ross|yes please
central perk|joey|youre not gonna like it.
central perk|ross|thats okay.
central perk|joey|you got married to fast.
central perk|ross|thats not advice
central perk|joey|i told ya.
central perk|ross|im going to the bathroom. gets up and exits.
central perk|joey|man, if anyone asked me to give up any of you, i couldnt do it. 
central perk|chandler and phoebe|yeah, me either.
central perk|monica|maybe i could do it.
central perk|rachel|entering hi
central perk|joey|hi, rach.
central perk|chandler|hi
central perk|phoebe|hey.
central perk|monica|hey.
central perk|rachel|look, i know you guys heard about the whole thing with me and ross but yknow, ive been obsessing about it all day and id just love not to talk about it. all right
central perk|joey|iii dont know if this falls under this category, but uh, ross is right back there. points over his shoulder.
central perk|rachel|thats not ross
central perk|phoebe|oh no not that guy he does look like him though.
central perk|chandler|okay, ross is in the bathroom.
central perk|rachel|oh my god, its happening. its already started. im kip.
central perk|joey|hey, youre not kip
central perk|rachel|to joey do you even know who kip is
central perk|joey|who cares youre rachel to chandler whos kip
central perk|chandler|kip, my old roommate, yknow we all used to hang out together.
central perk|joey|oh, that poor bastard.
central perk|rachel|see yeah, you told me the story. he and monica dated when they broke up they couldnt even be in the same room together and you all promised that you would stay his friend and what happened he got phased out
central perk|monica|youre not gonna be phased out
central perk|rachel|well, of course i am its not gonna happen to ross hes your brother. to chandler hes your old college roommate. ugh, it was just a matter of time before someone had to leave the group. i just always assumed phoebe would be the one to go.
central perk|phoebe|ehh
chandler and joeys|rachel|honey, come on you live far away youre not related. you lift right out.
chandler and joeys|chandler|entering hey
chandler and joeys|joey|hey, mr. bing. that uh, hotel you stayed at called. said someone left an eyelash curler in your room.
chandler and joeys|chandler|yes that was mine.
chandler and joeys|joey|cause i figured youd hooked up with some girl and shed left it there.
chandler and joeys|chandler|yes that would have made more sense.
central perk|joey|yknow, ii dont even feel like i know you anymore man all right, look, im just gonna ask you this one time. and whatever you say, ill believe ya. pause. were you, or were you not on a gay cruise phoebe keeps turning her head from to keep from looking at rachel.]
central perk|rachel|phoebe she turns her head further away. im sorry about the whole lifting out thing. moves over next to her. you gotta come with me
central perk|phoebe|come where
central perk|rachel|wherever i go. come on you and me, wellwell start a new group, were the best ones.
central perk|phoebe|okay, but try and get joey too.
central perk|ross|entering pheebs, you mind if i speak to rachel alone for a sec
central perk|phoebe|oh, sure she gets up to leave. bye ross whispering behind his back. forever.
central perk|ross|hi.
central perk|rachel|hi. what are you doing here isnt this against the rules
central perk|ross|i talked to monica, look, im the one who made the choice. im the one whos making things change, so i should be the one to yknow, step back.
central perk|rachel|oh, ross
central perk|ross|no, no, its okay. really. theyre plenty of people who just see their sisters at thanksgiving and just see their college roommates at reunions and just see joey at burger king. so is, is that better
central perk|rachel|no, its not better. i still dont get to see you.
central perk|ross|well, whatwhat would you do rach, if you were me, whatwhat would you do
central perk|rachel|well, for starters i wouldve said the right name at my wedding
central perk|ross|i cant believe this is happening.
central perk|rachel|i know.
central perk|ross|i am so sorry.
central perk|rachel|i know that too.
monica and rachels|joey|entering he clears his throat to get their attention. hey, rach sorry to interrupt but umm, phoebe wanted me to talk to you about a trip or something.
monica and rachels|chandler|entering hey
monica and rachels|monica|hi.
monica and rachels|chandler|i just came over to drop offnothing. so that weekend kinda sucked, huh
monica and rachels|monica|yeah, it did.
monica and rachels|chandler|so, i guess this is over.
monica and rachels|monica|what
monica and rachels|chandler|well, yknow, you and me, it had to end sometime.
monica and rachels|monica|why, exactly
monica and rachels|chandler|because of the weekend, we had a fight.
monica and rachels|monica|chandler thats crazy if you give up every time youd have a fight with someone youd never be with anyone longer thanohhh they both realize something there.
monica and rachels|chandler|so, this isnt over
monica and rachels|monica|laughs you are so cute no. no, it was a fight. you deal with it and move on its nothing to freak out about.
monica and rachels|chandler|really okay. great
monica and rachels|monica|ohh, welcome to an adult relationship she goes to kiss him.
monica and rachels|chandler|stops her were in a relationship
monica and rachels|monica|im afraid so.
monica and rachels|chandler|okay. they kiss. enters.]
monica and rachels|phoebe|hey
monica and rachels|monica|hey
monica and rachels|phoebe|oh hey, monica, i heard you saw donald trump at your convention.
monica and rachels|monica|yeah, i saw him waiting for an elevator. joey thinks that sounds familiar, but dismisses the thought.
monica and rachels|monica|hey, rach, can i borrow your eyelash curler, i think i lost mine.
monica and rachels|rachel|yeah, its in there. points to the bathroom. joey puts two and two together.
monica and rachels|joey|shocked oh ohh oh
monica and rachels|chandler|joey, can i talk to you for a second he grabs him and starts to drag joey into monicas room.
monica and rachels|joey|oohh ohh ohohoh ohoh chandler pushes him through the door and monica closes it behind them. [cut to monicas room, chandler tackles joey onto her bed and tries to cover his mouth.]
monica and rachels|joey|ohhhhhhhhhhh
monica and rachels|chandler|yes. yes. lets him up.
monica and rachels|joey|to chandler you to monica andand you
monica and rachels|monica|yes, but you cannot tell anyone no one knows
monica and rachels|joey|how when
monica and rachels|chandler|it happened in london.
monica and rachels|joey|in london 
monica and rachels|chandler|the reason we didnt tell anyone was because we didnt want to make a big deal out of it.
monica and rachels|joey|but it is a big deal i have to tell someone  they both grab him and stop him.
monica and rachels|chandler|nonononono you cant
monica and rachels|monica|please please we just dont want to deal with telling everyone, okay just promise you wont tell. joey thinks it over.
monica and rachels|joey|all right man, this is unbelievable i mean, its great, but
monica and rachels|monica|i know, its great she goes over and kisses chandler.
monica and rachels|joey|aww, i dont want to see that [cut to phoebe and rachel.]
monica and rachels|phoebe|were so stupid do you know whats going on in there theyre trying to take joey ending credits reading hers.]
monica and rachels|phoebe|the most popular phoebe in tennis is called the overhand phoebe. and if you win, you must slap your opponent on the phoebe and say, hi, phoebe
monica and rachels|monica|oh thats cute we really all enjoyed it. but yknow, it doesnt count.
monica and rachels|phoebe|count for what
monica and rachels|monica|count in our heads asas good madlibs. they putting their notepads down and get up to leave.
monica and rachels|joey|i guess im done.
monica and rachels|chandler|funs over
monica and rachels|monica|waitwait, guys ifif we follow the rules, its still fun and it means something
monica and rachels|rachel|uhhuh
monica and rachels|joey|i think im gonna takeoff.
