the hallway|rachel|joey are you in there [cut to inside monica and chandlers, monica, chandler and joey are eating breakfast.]
the hallway|joey|hearing rachel and jumping up with his plate oh god thats rachel
the hallway|monica|joey, you have to talk to her
the hallway|joey|nono, i cant i cant not after the other night, its just itstoo weird, okay dont tell her im here turns to run to the bathroom and his bagel falls off the plate onto the floor. dont eat that runs to the bathroom as rachel enters.
the hallway|rachel|hey
the hallway|chandler|hey
the hallway|monica|hey rachel
the hallway|rachel|is joey here
the hallway|chandler|i dont see him. to monica do you see him
the hallway|monica|i dont see him. hey maybe hes in the sugar bowl opens the sugar bowl joey nope closes the sugar bowl and they both laugh.
the hallway|rachel|well, at least you make each other laugh.
the hallway|monica|whats up
the hallway|rachel|well, i havent seen him since that night that he told me how he yknow i dont know, i think hes avoiding me. why is that bagel on the floor
the hallway|monica|we were playing a game.
the hallway|rachel|ew, was chandler naked sort of like a, like a ring toss kind of situation
the hallway|monica|sure.
the hallway|chandler|what no no
the hallway|rachel|all right. well listen, if you see joey will you just tell him uhtell him i miss him. exits and joey enters.
the hallway|monica|to joey okay, did you hear that
the hallway|joey|yeah, a naked bagel game picks up his dropped bagel. to chandler dude, i dont know. thats a pretty small hole.
the hallway|monica|honey, you gotta talk to her.
the hallway|joey|i cant yknow you guys dont know what its like to put yourself out there like that and just get shot down.
the hallway|chandler|incredulous i dont know what thats like up until i was 25 i thought the only response to, i love you, was, oh crap
the hallway|monica|hello no rejection i got shot down at fat camp boy, kids are mean when theyre hungry.
the hallway|joey|all right so, so what do i do
the hallway|monica|this is rachel. i mean, what are you gonna do, never going to talk to her again i mean i know its weird, its awkward, but you gotta at least try.
the hallway|joey|yeah. okay. goes to take a bite out of the previously mentioned bagel. whoa stops. i almost forgot this was on your
central perk|chandler|interrupting him we didnt play it opening credits tea as chandler looks on.]
central perk|phoebe|okay, so when youre done with your tea ill look at your leaves and tell you your fortune.
central perk|chandler|i didnt know you read tea leaves.
central perk|phoebe|oh yeah, ive done it for years. i actually stopped because i was so accurate. yknow, andand yknow, one of the great joys of life is itsits wondrous unpredictability. yknow and also tea tends to give me the trots.
central perk|monica|okay, im done. read mine.
central perk|phoebe|okay. looks at the leaves. ooh, i see a ladder. checks the book which can mean either a promotion or a violent death.
central perk|monica|stunned iim the head chef. ii cant get promoted.
central perk|phoebe|uhhmm. uhhmm, whos next
central perk|rachel|okay, im done. do mine.
central perk|phoebe|okay. reads the leaves umm, oh okay, i see a circle.
central perk|rachel|ah.
central perk|phoebe|oh checking the book which can either mean youre having a baby or youre gonna make a scientific discovery
central perk|rachel|well, i have been spending a lot of time in the lab.
central perk|chandler|what does yours say pheebs
central perk|phoebe|umm wow, all right. checks the book. wow yay ooh, im gonna meet a guy and really soon and hes gonna be the man of my dreams. probably not the guy i had a dream about last night. points at chandler.
central perk|ross|entering hey has anyone seen my shirt its a button down, like a, like a faded salmon
central perk|monica|you mean your pink shirt
central perk|ross|faded salmon color.
central perk|monica|no, ii havent seen your pink shirt.
central perk|ross|great great. then i mustve left it at monas. i knew it
central perk|chandler|well, im sure you get another one at ann taylors.
central perk|ross|thats my favorite shirt okay i love that shirt
central perk|rachel|well just ask mona to give it back
central perk|ross|i dont know. i mean ii guess i could. its just that we didnt really end things such good terms. and if i go over there id be ignoring the one thing she asked me to do when we broke up, jump up my own ass and die. walks away.
central perk|phoebe|noticing a guy sitting by the green post looking at her oh wait a second you guysfor the last couple weeks ive been that guy everywhere i go. we take the same bus. we go to the same bookstore, the same dry cleaners maybe hes the tea guy. he gets up to leave, and smiles at phoebe.
central perk|chandler|phoebe, did you see that he totally checked you out he is so cute looking at his tea. mine has a picture of the village people, what does that mean joey enters.
central perk|rachel|hi
central perk|joey|hey. he slowly walks to the other side of the couch and sits down at the table, an awkward silence follows.
central perk|rachel|hi.
central perk|joey|hi. more awkward silence.
monica and chandlers|monica|tea gives phoebe the trots.
monica and chandlers|rachel|so i thought joey and i would be okay once we hung out, but its not even like we know how to be with each other anymore.
monica and chandlers|chandler|i know its tough now, but things will get better.
monica and chandlers|rachel|how do you know that what if it just gets worse and worse and worse, to the point where we cant even be in the same room with each other
monica and chandlers|chandler|im not great at the advice, can i interest you in a sarcastic comment some cheese
monica and chandlers|monica|honey, what is the bruce springsteen cd in the kat stevens case
monica and chandlers|chandler|lets just say if i cant find the right cd case i just put it in the nearest one.
monica and chandlers|monica|okay, where is the kat stevens cd
monica and chandlers|chandler|in the james taylor case.
monica and chandlers|monica|where is the james taylor cd
monica and chandlers|chandler|honey, im gonna save you some time, 200 cds, not one of them in the right case.
monica and chandlers|monica|okay. no need to panic. deep breathes everyone. okay umm uh, were just gonna have to spend some time and put the cds in the right cases.
monica and chandlers|chandler|well, if were gonna do that we should come up with some kind of order. yknow alphabetically or by genre
monica and chandlers|monica|hmm, i dont know. we really have to talk this through.
monica and chandlers|rachel|oh my god you guys have such problems i feel so terrible for you
monica and chandlers|monica|okay, iim sorry. you and joey, your both focusing on this uncomfortable thing, what you need to do is to change the subject. next time you see him try to get him talking about something else.
monica and chandlers|rachel|oh yeah. that makes sense.
monica and chandlers|monica|yeah, like i dont know, maybe you have a work problem that you need his advice on.
monica and chandlers|rachel|ooh, i can do that.
monica and chandlers|monica|good. to chandler uh honey, the miami vice soundtrack really
monica and chandlers|chandler|they were just giving those away at the store off monicas look in exchange for money.
monica and chandlers|joey|entering hey
monica and chandlers|rachel|hi.
monica and chandlers|monica|uh i really dont know what to tell you rach, i really dont. i mean, maybe joey can help you out with your, with your big work problem.
monica and chandlers|rachel|what
monica and chandlers|monica|yeah joey shesrachels got this really big work problem, and it is a head scratcher. wow to chandler yknow what, if were gonna make dinner were gonna have to leave. yeah. she and chandler exit.
monica and chandlers|joey|so you uh, have abig work problem
monica and chandlers|rachel|yeah its umm yeah its uh itits yknowits nothing.
monica and chandlers|joey|huh. okay. awkward silence. so uh, i think im gonna take off.
monica and chandlers|rachel|yeahno wait joey no wait it is. its something. itsits ummits my boss.
monica and chandlers|joey|yeah
monica and chandlers|rachel|yeah, and umm my baby.
monica and chandlers|joey|yeah
monica and chandlers|rachel|my boss wants to buy my baby
monica and chandlers|joey|what oh myoh my god
monica and chandlers|rachel|i know i told you, its a really big problem.
monica and chandlers|joey|what he wants to buy your baby
monica and chandlers|rachel|can you believe that
monica and chandlers|joey|thats crazy
monica and chandlers|rachel|thats what i told him
monica and chandlers|joey|okay, how did this even happen
monica and chandlers|rachel|well ill tell ya pause see uh mymy boss and his wifetheythey cant have children. so umm, and thatwe were at the christmas party, and he got drunk, and he said to me, rachel, i want to buy your baby.
monica and chandlers|joey|man when you said it was a problem about your boss and the baby i figured it was something about maternity leave.
a newsstand|rachel|ohh yeah pause yeah thatthat wouldve been a much simpler problem. and picks up a newspaper.]
a newsstand|phoebe|oh hello.
a newsstand|guy|oh, its you. i see you everywhere. im jim, jim nelson.
a newsstand|phoebe|oh jim, jim nelson im phoebe, phoebe buffay. we certainly have been seeing a lot of each other lately. 
a newsstand|jim|we have. maybe well be seeing each other at dinner tomorrow night, say around 8 oclock
outside monas apartment|phoebe|well, maybe we will. starts to walk away. oh she turns around and the exchange information.
outside monas apartment|ross|mona theres no answer, so he starts to leave but remembers where her extra key is. he reaches atop a hall light just outside her door and grabs the key. he looks at in triumph as the pain from it being hot moves along his nervous system to his brain, and when it arrives his brain orders his hand to drop the hot key and his mouth to squeal in pain. after dropping the key he pulls his shirtsleeve over his hand and uses the key to open the door and enter monas apartment. okay, if i were a salmon shirt, where would i be he hears a key in the door and as it opens he dives behind the couch.
outside monas apartment|mona|entering, with her date i am so sorry i spilled wine all over your shirt.
outside monas apartment|monas date|oh, its okay.
outside monas apartment|mona|no, its still wet. yknow what let me get it out before it sets. ooh, i have something you can wear. here. hands him rosss shirt. 
outside monas apartment|monas date|oh umm, ii dont know if i want to wear a womans shirt.
outside monas apartment|mona|nono thats a mans shirt.
monica and chandlers|monas date|its awfully pink. ross mouths, its salmon
monica and chandlers|chandler|oh my god, honey we are so meant to be together. we both have copies of the annie soundtrack.
monica and chandlers|monica|honey, both yours.
monica and chandlers|rachel|entering hey great advice on that joey thing
monica and chandlers|monica|yeah the work problem
monica and chandlers|rachel|oh it was perfect i mean it really felt like he was my friend again.
monica and chandlers|chandler|what problem did you tell him you had
mr|rachel|oh thats not important. the point is, i reallyi think everythings gonna be okay.
mr|mr. zelner|may i help you
a restaurant|joey|do you think you can just buy my friends baby commercial break
a restaurant|phoebe|isnt it funny how we kept running into each other its as if someone really wants us to be together.
a restaurant|jim|someone does. me.
a restaurant|phoebe|oh, witty banter. well done.
a restaurant|jim|so, tell me a little bit about yourself.
a restaurant|phoebe|oh okay, well im a masseuse, and i used to work at this place
a restaurant|jim|do you like to party
a restaurant|phoebe|iii like, i like parties.
a restaurant|jim|youre wild, arent ya
a restaurant|phoebe|yeah i guess, a little.
a restaurant|jim|it aint no thing, im wild too.
a restaurant|phoebe|a little freaked out so umm, anyway ii lived in new york, someone wildly i guess, for ummwell since i was fourteen.
a restaurant|jim|im sorry. im staring. its just that you have the most beautiful eyes.
a restaurant|phoebe|oh stop it.
a restaurant|jim|and your breasts hmm
a restaurant|phoebe|okay. umm look, youre coming on a little strong. but im going to give you the benefit of the doubt, because it seems the universe really wants to be together. so, why dont we just start over okay and you can just tell me about yourself.
a restaurant|jim|all right.
a restaurant|phoebe|okay.
a restaurant|jim|i write erotic novels, for children.
a restaurant|phoebe|what
a restaurant|jim|theyre wildly unpopular.
a restaurant|phoebe|oh my god
a restaurant|jim|oh also, you might be interested to know that i have a ph.d.
a restaurant|phoebe|wow you do
a restaurant|jim|yeah, looks at his crotch a pretty huge
monica and chandlers|phoebe|all right. gets up and walks out.
monica and chandlers|chandler|singing the sunll come outtomorrow betyour bottom dollar that tomorrow the girls start laughing, and in a deep voice therell be sun.
monica and chandlers|joey|entering hey
monica and chandlers|rachel|hey oh joey, honey listen, thank you for talking to my yesterday about that thing with my boss. that really meant a lot.
monica and chandlers|joey|not a problem. oh, and just so you know, that guys not going to be bothering you about that baby thing anymore.
monica and chandlers|rachel|worried what
monica and chandlers|joey|lets just say i took care of it.
monica and chandlers|rachel|whoawhoawhoa, lets say more
monica and chandlers|joey|dont worry dont worry. i just told him, very nicely, you dont go buying peoples babies, so back off
monica and chandlers|rachel|what 
monica and chandlers|chandler and monica|what
monica and chandlers|rachel|no no, nonono joey he doesnt want to buy my baby i made that up
monica and chandlers|joey|what why
monica and chandlers|rachel|so that we would have something to talk about so it wouldnt be awkward
monica and chandlers|joey|and you couldnt think of anything else
monica and chandlers|monica|you said your boss wants to buy your baby
monica and chandlers|rachel|to joey i cant believe that you yelled at my boss imim gonna lose my job what am i going to do
monica and chandlers|chandler|you can always sell your baby.
monica and chandlers|rachel|oh joey, i cant believe you brought my boss into this im gonna get fired
monica and chandlers|joey|you lied to me
monica and chandlers|rachel|well, she told me too points to monica and joey glares at her.
monas apartment|monica|chandler has two copies of annie magazine while lying behind the couch and sees something that he likes. meanwhile, monas date takes off rosss shirt and mona throws it on the floor. while they start making out again, ross tries to pull the rug the shirt is on over to him, but while he does that he moves the coffee table and it bumps into the couch.]
monas apartment|mona|seeing ross oh my god ross
monas apartment|ross|hello
monas apartment|mona|ross, what are you doing
mr|ross|not touching myself if that makes anyone less uncomfortable.
mr|rachel|morning. you wanted to see me
mr|mr. zelner|please, come in. have a seat. she does so.
mr|rachel|okay look mr. zelner
mr|mr. zelner|oh i think its best that i speak first.
mr|rachel|yeah. motions for him to continue.
mr|mr. zelner|ive asked lee from human resources to be here as a witness to our conversation.
mr|rachel|oh god.
mr|mr. zelner|if i in any way implied that i wanted to buy your babyi am sorry. okay last week when i asked you when your due date was uh, i certainly did not mean that i felt that i was due your baby. yeah, i want to be very clear that i understand that its your baby, and it is not mine to purchase.
a street|rachel|well, as long as we are clear about that. exits smugly.
a street|phoebe|oh there it is.
a street|monica|thats not your regular dry cleaners.
a street|phoebe|i know, but that creep that i went on that date with goes to there so i have to find a new one. i also have to find a new video store, a new bank, a new adult bookstore, a new grocery store
a street|monica|what
a street|phoebe|a new grocery store. the universe said i was going to meet a nice guy and thats what they gave me looks up when i get up there im going to kick some ass.
a street|monica|dont worry phoebe, youre gonna meet someone. if i can meet a great guy, so can you.
a street|phoebe|yeah, we both can. and we both will. they enter the dry cleaners.
a street|phoebe|oh, you didnt have to come in with me.
a street|monica|are you kidding this is where they get out stains okay this is like disneyland for me. imim gonna be over here watching the dance of the clean shirts. she points to and walks over to the electric clothes rack they have.
a street|phoebe|okay. a guy enters that looks suspiciously like alec baldwin from the hunt for red october, pearl harbor, and beetlejuice.
a street|guy|to phoebe oh, excuse me i think you dropped slooks at phoebe. wow
a street|phoebe|what
a street|guy|im sorry, its just that youre so incredibly beautiful.
a street|phoebe|oh yeah well, im sorry about that too, but what are you going to do
a street|guy|i hope you dont think im crazy but i feel like i was meant to pick this up, do you believe in that kind of thing
a street|phoebe|a little. she turns around and looks up. to the universe now youre talking.
a street|guy|would you like to go out and have a cup of coffee
a street|phoebe|iiid love to. let me just tell my friend.
a street|monica|to the clerk ooh, an ink stain hey, can i watch how you get this out
monica and chandlers|phoebe|looking around she mustve left. enters.]
monica and chandlers|rachel|hi.
monica and chandlers|joey|so whatwhatwhat happened
monica and chandlers|rachel|its all gonna be okay. theyre just so happy that im not suing them that they gave me one extra month paid maternity leave. so long as i understand that the money should not construed as a down payment on this or any other child i should bear.
monica and chandlers|chandler|wow, ralph lauren is really going out of there way to show theyre not in the baby buying business.
monica and chandlers|rachel|chandler, can you give us a minute
monica and chandlers|chandler|oh im sorry, youre kicking me out of my own living room
monica and chandlers|rachel|yeah.
monica and chandlers|chandler|ill be in there. goes into the bedroom.
monica and chandlers|rachel|joey, im really sorry that i lied to you. i was just trying to make things
monica and chandlers|joey|i know. i know.
monica and chandlers|rachel|it kinda worked. i mean yknow, i dont know about you buy i havent thought about our thing since all this.
monica and chandlers|joey|hey youre right. yeah, its kinda been like us again a little bit.
monica and chandlers|rachel|yeah i know i miss that.
monica and chandlers|joey|me too. i mean ihavent thought at all about how i put myself out there and said all that stuff and how you didnt feel the same way about me andand how it was really awkward. awkward silence.
ross and rachels|rachel|my gynecologist tried to kill me. closing credits
ross and rachels|ross|on phone item j437a, color: winterberry. theres a knock on the door as he hangs up the phone. he answers it to mona. hi umm, listen come here, come in. she does so. im soso sorry about yesterday. iim really sorry. its just that i he picks up the pink shirt.
ross and rachels|mona|interrupting him listen ross, you dont have to apologize. i understand why you were there.
ross and rachels|ross|you do
ross and rachels|mona|yeah, you still have feelings for me. andand to be honest, ii still have feelings for you. and i wish that we can work it out ross, but we cant. its too complicated with you and rachel and the baby, ii just it just wasnt meant to be.
ross and rachels|ross|faking starting to cry oh god youre right.
ross and rachels|mona|ross, wewe have to be strong. okay, iim gonna go. she picks up the shirt ross has just set down. can i to remember you
