central perk|joey|can i see the comics
central perk|chandler|this is the new york times.
central perk|joey|okay, may i see the comics [monica and phoebe enter.]
central perk|monica|guys. i thought you were taking ross to the game
central perk|chandler|we are. hes meeting us here.
central perk|monica|no rachel is meeting us here.
central perk|phoebe|oh come on, they can be in the same room.
central perk|joey|yeah, you shoulda been there last night.
central perk|phoebe|why what happened now
central perk|joey|well ross was hangin out over at our place, rachel comes over to borrow some moisturiser from chandler....
central perk|chandler|yeah yyou, how hard is it to say something rachel came over to borrow something.
central perk|joey|anyway her and ross just started yelling at each other.
central perk|phoebe|wait. why was he yelling at her hes the one who slept with someone else. 
central perk|joey|well, i guess he says that because they were on a break when it happened, that she should of forgiven him by now.
central perk|phoebe|whoa he is soo unreasonable god, although i think i understand what he means. oh my god, this is like 60 minutes, okay, when, when, at first youre really mad at that pharmaceutical company for making the drug and then yknow you just feel bad for the people because they needed to make their hair grow.
central perk|chandler|yknow what this is like this is like when my parents got divorced. man, i hope ross doesnt try to kidnap me after cub scouts.
central perk|phoebe|yknow i had a dream where ross and rachel were still together, they never broke up. and we were all just like hanging out, and everyone was happy....
central perk|joey|i had the same dream
central perk|phoebe|yeah, and nobody slept with that xerox girl. 
central perk|joey|oh, i had the opposite dream.
central perk|chandler|yknow what maybe its gonna be okay, i mean its been a week.
central perk|joey|yeah, i mean its never taken me a week to get over a relationship.
central perk|monica|its never taken you more than a shower to get over a relationship. [rachel enters.]
central perk|monica|seeing her okay, lets go lets hit the road
central perk|rachel|hey
central perk|monica|lets get the show on it 
central perk|rachel|okay, let me just get a cup of coffee.
central perk|monica|oh rachel, i know the best coffee house and its sooo close.
central perk|rachel|closer than here
central perk|phoebe|turning around and picking a cup off of a table oh, hey, look, i found coffee handing her the cup okay, lets skedaddle.
central perk|rachel|wait, im not just gonna drink somebodys old coffee.
central perk|phoebe|okay, your highness. [ross enters behind rachel, and look at each other for a moment.]
chandler and joeys|phoebe|in a deep voice, imitating ross um, rachel im really sorry. imitating rachel thats okay, do you wanna get back together imitating ross yeah, okay. in her normal voice did anyone else hear that opening credits is trying to eat chinese with chopsticks and fails miserably. theres a knock on the door, and chandler answers it to reveal rachel]
chandler and joeys|rachel|softly is he here
chandler and joeys|chandler|no.
chandler and joeys|rachel|oh. smiles heres your moisturiser. hi 
chandler and joeys|monica and phoebe|hey
chandler and joeys|rachel|you guys are gonna love meee okay, check it out, thursday night, five tickets, calvin klein lingerie show, and you guys are coming with me. theyre all silent and look away okay, i said that out loud right
chandler and joeys|chandler|yes, yes, its just that we ah, we kinda all ready, made plans with ross.
chandler and joeys|rachel|oh, well okay. well, there you go.
chandler and joeys|phoebe|no, its just that he got this new like home theater dealie, and he wants yknow, us to check it out.
chandler and joeys|rachel|hmmm.
chandler and joeys|chandler|yeah, hes really excited about it too, he even recorded show times on his answering machine.
chandler and joeys|rachel|ohh
chandler and joeys|monica|were sorry honey.
chandler and joeys|rachel|oh, its okay. starts to leave
chandler and joeys|joey|rach, its, its ah, its not that we dont want to, really. quietly are we talking models in their underwear
chandler and joeys|rachel|and heels.
chandler and joeys|joey|he turns around to chandler looking for approval to go with rachel, chandler mouths come on turning back to rachel ross, did ask us first, and we set that night aside.
chandler and joeys|rachel|no, hey, come on, if he asked you first, thats only fair. leaves [chandler makes a noise of absolute disgust and heads into the living room.]
chandler and joeys|phoebe|ohhh boy, do i feel bad.
chandler and joeys|joey|oh yeah.
chandler and joeys|monica|very bad. [we see chandler lighting up a cigarette.]
chandler and joeys|phoebe|chandler what are you doing
chandler and joeys|monica|chandler
chandler and joeys|chandler|jumps back and points at the cigarette oh my god
chandler and joeys|joey|youre smoking again
chandler and joeys|chandler|well, actually, yesterday i was smoking again. today, im, im smoking still.
chandler and joeys|phoebe|why would you start again after chewing all that quitting gum
chandler and joeys|chandler|look, im telling you this is just like my parents divorce, which is when i started smoking in the first place.
chandler and joeys|monica|werent you nine
chandler and joeys|chandler|yeahhh. im tellin ya something, that ah, first smoke after nap time.... [theres a knock on the door.]
chandler and joeys|chandler|oh thats great, with my luck, thats gonna be him.
chandler and joeys|phoebe|him him, ross
chandler and joeys|chandler|nope, hymn 253, his eyes are on the sparrow when my parents got divorced is when i started using humour as a defence mechanism. answers the door and its rachel again.
chandler and joeys|rachel|hi uhh, do you guys have plans for the weekend because i have my sister on hold, and she said that we could use her cabin for the weekend and go skiing. huh im asking you first, right. i mean im playing by the rules.
chandler and joeys|all|absolutely, yeah
chandler and joeys|rachel|chandler youre smoking what are you doing
rosss|chandler|hey, shut up youre not my real mom smoke by an open window.]
rosss|joey|obviously cold hey, can you close that window chandler my nipples can cut glass over here
rosss|phoebe|wait. really cause mine get me out of tickets.
rosss|ross|look, you guys i just wanna say, i really, really appreciate you spending this time with me. its been a pretty hard time right now, so i just wanna say thanks.
rosss|chandler|can somebody else hug him i have to stay by the window.
rosss|ross|oh hey, hey, huh, how about this weekend we have a laser disc marathon okay, and maybe a tournament on my new dart board huh, huh, what do you think in an irish accent two days of darts, itll be great
rosss|joey|itll be great for next weekend.
rosss|ross|no, no, no, this weekend guys
rosss|joey|itll be great for next weekend. i mean, in an irish accent itll be grrreat.
rosss|ross|whats going on
rosss|phoebe|well, we were um, sorta invited to go skiing, yknow rachels sisters cabin. chandler goes back to the window to smoke again.
rosss|ross|so, for the whole weekend
rosss|monica|were really sorry, but um, she did ask us first.
rosss|ross|yeah, thats okay, i mean if you guys all have to go away for the first weekend im alone by myself, yknow then i totally, totally understand.
rosss|phoebe|yknow what, i can stay, im gonna stay. cause the last time i went skiing i was to afraid to jump off the chair lift, i just went around and around.
rosss|joey|uh, pheebs we kinda need you to drive us all up there in your grandmothers cab, but yknow what, ill stay.
rosss|monica|noo ill stay. hes my brother.
rosss|ross|what a pity stay
rosss|monica|no were gonna have fun. we can make fudge
rosss|ross|pity food yknow what thats okay, all right, i dont need any of you to stay, okay nobody stays.
in phoebes grandmothers cab|chandler|well, then, i might as well offer to stay. driving, rachels sitting shotgun, chandler, monica, and joey are in the back seat.]
in phoebes grandmothers cab|joey|to chandler and monica hey, does anybody else feel bad about ross
in phoebes grandmothers cab|monica|why do you think hes still mad at us
in phoebes grandmothers cab|chandler|to joey well hes probably mad after you called him this morning to borrow his goggles.
in phoebes grandmothers cab|joey|what mine arent tinted. [chandler starts to light a cigarette.]
in phoebes grandmothers cab|phoebe|chandler
in phoebes grandmothers cab|chandler|what
in phoebes grandmothers cab|phoebe|what does the sign say
in phoebes grandmothers cab|chandler|beam me up jesus.
in phoebes grandmothers cab|phoebe|no, the no smoking sign. theres no smoking in my grandmothers cab.
in phoebes grandmothers cab|chandler|okay, well, then, ii have to go to the bathroom.
in phoebes grandmothers cab|all|oh
in phoebes grandmothers cab|phoebe|please
in phoebes grandmothers cab|monica|no chandler no no unscheduled stops. you can go when we stop for gas.
in phoebes grandmothers cab|chandler|oh, come on, theres a rest stop right up there come on, i really have to goooooooooo.
the rest stop|joey|oh, now i have to go
the rest stop|chandler|here we go. okay, brace yourselves.
the rest stop|monica|what [both chandler and joey put their feet up against the glass, monica doesnt and gets thrown up against the glass.]
the rest stop|rachel|okay.
the rest stop|monica|ow [joey gets out and sprints to the bathroom and chandler follows with a cigarette in his hands.]
the rest stop|phoebe|to rachel, whos staying in the cab. arent you gonna go
the rest stop|rachel|no. thank you.
the rest stop|monica|getting out no, rachel never pees in public restrooms.
the rest stop|rachel|well, they never have any paper in there yknow. so my rule is no tissue, no tuschy. phoebe laughs and gets out. well, if everybodys going. she gets out and starts to close the door.
the rest stop|phoebe|no, yknow what dont close it rachel slams the door shut locking themselves out. cause the... keys...are in there.
the rest stop|chandler|oh, nononononono
the rest stop|joey|whats going on
the rest stop|chandler|to joey my lighters in there points to the cab commercial break bumper.]
the rest stop|chandler|damn stands up the tailpipes not hot enough to light this
the rest stop|joey|relax okay, iii can get this open. anybody have a coat hanger
the rest stop|chandler|oh i do op, no, wait a minute, i took it out of my shirt when i put it on this morning.
the rest stop|monica|so, if youre parents hadnt got divorced, youd be able to answer a question like a normal person
the rest stop|joey|look, i just need a wire something to jimmy it. oh hey, one of you guys give me the underwire from your bra
the rest stop|monica|what
the rest stop|rachel|what
the rest stop|joey|come on who has the biggest boobs
the rest stop|monica|please
the rest stop|joey|whoever has the biggest boobs, has the biggest bra, therefore has the biggest wire.
the rest stop|the girls|no, not getting my bra
the rest stop|joey|if you wanna get back in the car, we need the wire, your call.
the rest stop|phoebe|okay, monicas are the biggest.
the rest stop|monica|these tiny, little nonbreasts please, its gotta be rachel.
the rest stop|rachel|what, no, no, no, mine are deceptively small i mean, iii actually sometimes, ststuff my bra.
the rest stop|monica|all right then, your bra would still be big.
the rest stop|rachel|no, i stuff outside the bra.
the rest stop|chandler|ladies, ladies, lets just compromise okay phoebe, rachel take off monicas bra.
the rest stop|phoebe|all right, forget it, nevermind, you can have mine. [chandler crumples up his cigarette pack and throws it on the ground.]
the rest stop|rachel|seeing him chandler, what are you doing there is a trash can right there.
the rest stop|chandler|well, i thought if i littered, that crying indian might come by and save us.
the rest stop|phoebe|finishing removing her bra okay, there.
the rest stop|joey|thank you phoebe, that is very, very generous.
the rest stop|chandler|okay, now lets decide who has the nicest ass.
the rest stop|joey|opening the door and there you go
the rest stop|all|oh, yeahhhhh [they all run to get in the cab, and chandler pulls out a smoke.]
the rest stop|monica|chandler
the rest stop|chandler|at least let me smoke it to the good part. [phoebe puts the car in gear and starts to back out.]
the rest stop|phoebe|okay. the car moves a few feet and sputters to a stop. oh, no
the rest stop|rachel|what, whats it, whats going on
the rest stop|phoebe|yeah, this has happened before.
the rest stop|rachel|so you know how to fix it
carol and susans|phoebe|yep. put more gas in. is a knock on the door.]
carol and susans|carol|answering the door hi 
carol and susans|ross|entering hey.
carol and susans|carol|hey, what are you doing here
carol and susans|ross|well, oh just ah, i was just wondering, when you and i split up, did you get the tape that was half the last episode of mash and half the hostages coming home
carol and susans|carol|ah yeah, but now its susan and me in mexico and the hostages coming home.
carol and susans|ross|wheres ben
carol and susans|carol|hes sleeping.
carol and susans|ross|ahh. notices the table ooh, is this a ah, is this a bad time
carol and susans|carol|umm, yeah, actually, susans gonna be home any minute, its kinda an anniversary.
carol and susans|ross|oh i thought you guys got married in uh, january
carol and susans|carol|its not that kind of anniversary.
carol and susans|ross|ah realises oh.
carol and susans|carol|sooo anyway...
carol and susans|ross|umm, candles, champagne, yeah anniversaries are great. cause you know love lasts forever, yknow. nothing like it in this lifetime, money in the bank, so rachel and i broke up.
carol and susans|carol|oh god, ross i am so sorry.
carol and susans|ross|yeah, well.
carol and susans|carol|yknow what, i want to talk to you about this so much, but we should probably do it when we could really get into it, are you free for dinner tomorrow night
carol and susans|ross|oh yeah, id love that.
carol and susans|carol|oh, great me too.
the rest stop|ross|i guess it all started when rachel got this new job. he sits down at the table.
the rest stop|phoebe|okay, yeah. to monica and rachel triple a can pick us up.
the rest stop|rachel|great
the rest stop|phoebe|yeah, what town are we near
the rest stop|monica|freemont. westwestmont, ah westburg
the rest stop|phoebe|to monica then why are you answering do you at least know what route were on
the rest stop|rachel|yeah, we are definitely on route 27.
the rest stop|phoebe|okay. on phone we are at a rest stop on route 27. okay. to rachel there is no route 27. listens to rachel okay, either 93 or 76
the rest stop|rachel|i dont know, im sorry, i always slept in the back when we drove up here.
the rest stop|phoebe|okay. on phone hey, can you send somebody up and down 76 and check every rest stop, and, and also 93 listens okay hangs up yeah, no they dont do that.
the rest stop|rachel|ugh, okay, well somebody will come and save us.
the rest stop|monica|who i mean have you seen a car come by here in the last hour and a half i think we should call ross, maybe he can get a car and come pick us up.
the rest stop|rachel|no no, i am not getting in a car with ross, we will just have to live here 
the rest stop|phoebe|but if...
the rest stop|rachel|no you guys, i am not getting in a car with him, youll have to think of something else.
the rest stop|phoebe|oh good, oh joey and chandler are back. [joey walks up helping chandler.]
the rest stop|monica|so the going for help went well
the rest stop|joey|oh yeah, smokey joe here got half way to the highway and collapsed.
the rest stop|chandler|i have the lung capacity of a two year old. starts to light another cigarette.
the rest stop|monica|then why are you smoking
carol and susans|chandler|well its very unsettling.
carol and susans|ross|....right right i mean its pretty unbelievable yknow, i mean they just took off, took off without even looking back. yknow i dont, i dont need them, huh, ive got you guys now as friends, you and susan.
carol and susans|carol|ah, susan will be so pleased. [rosss beeper goes off.]
carol and susans|ross|looking at the page 717 to carol wheres 717 he gets up to return the page, carol starts to take the last of the food into the kitchen, but ross grabs the last piece. hey, youve have more of these for susan right
carol and susans|carol|no. but its okay, ill just put out pickles or something. [cut to the rest stop, monica and phoebe are waiting anxiously by the phone as it rings.]
carol and susans|phoebe|answering the phone whispering ross, thank god.
carol and susans|ross|pheebs what, why are you whispering
carol and susans|phoebe|i ate a bug. [rachel starts to walk up.]
carol and susans|monica|running over to stop rachel hey rach, the tampons here are only a penny. lets stock up. takes her into the bathroom
carol and susans|phoebe|listen ross, we ran out of gas, and we dont know where we are, so we cant get a tow truck.
carol and susans|ross|oh, now you want a favour
carol and susans|phoebe|yes, please.
carol and susans|ross|well, oh, im sorry your car broke down pheebs, but im a little too busy with some of my real friends right now, but please call to let me know you got home safely okay
carol and susans|carol|running over and grabbing the phone away from ross on phone phoebe, hang on a second. hands ross her keys here, take my car, go pick up your friends.
carol and susans|ross|no, im not gonna pick them up.
carol and susans|carol|listen, we both know youre gonna do it cause youre not a jerk. okay so you can either sulk here for a half hour and then go pick them up, or save us both time and sulk in the car.
carol and susans|ross|no, rachel doesnt want me to....
carol and susans|carol|look, iii am sorry that rachel dumped you cause she fell in love with that mark guy, and you are the innocent victim in all of this, but dont punish your friends for what rachel did to you.
carol and susans|ross|yeah, youre right.
carol and susans|carol|on phone phoebe hang on a second ross wants to say something. listens what listens to ross you slept with someone else
carol and susans|ross|we were on a break okay grabs the phone we were, we were..., calms down yeah. where are you ill find you. hangs up
carol and susans|carol|you slept with another woman
the rest stop|ross|oh, youyoureyoure one to talk.
the rest stop|joey|okay, done.
the rest stop|monica|reading the sign whats pleh
the rest stop|joey|thats help spelled backwards so that the helicopters can read it from the air
the rest stop|monica|huh. whats doofus spelled backwards [ross drives up.]
the rest stop|rachel|all excited op, op, car car sees its ross ugh
the rest stop|phoebe|oh, its ross on one of his drives
the rest stop|chandler and joey|hey
the rest stop|phoebe|hi
the rest stop|rachel|what is he doing here
the rest stop|ross|he is saving your butt, ah, unless of course im stepping on some toes here, in which case i can just mosey on, ive got plenty of people to help on the interstate.
the rest stop|all|no come on
the rest stop|rachel|all right fine fine. [ross grabs the gas can he brought along, and walks through joeys sign destroying it.]
the rest stop|joey|arrrghh
the rest stop|chandler|oh no, now its not gonna make any sense
the rest stop|phoebe|to chandler and monica you guys, what, what do we do about ross who drove all the way up here what do we do just like send him back and were then gonna go skiing
the rest stop|chandler|oh, this is horrible, its just horrible.
the rest stop|joey|guys, do you think we should ask ross to come along
the rest stop|monica|i know, what about rachel i mean how are we even gonna ask her
the rest stop|rachel|ask me what
the rest stop|monica|umm, if ah, it might be okay if ross came skiing
the rest stop|chandler, phoebe, and joey|no, i wasnt gonna ask you that, no.
the rest stop|rachel|you guys are unbelievable. no he cannot come.
the rest stop|ross|excuse me
the rest stop|chandler|its horrible.
the rest stop|ross|sarcastic oh please, cant i come to your special, magical cabin
the rest stop|rachel|why would you even want to come ross youre a horrible skier.
the rest stop|ross|ohoh, hitting me where it hurts, my ski skills.
the rest stop|monica|here we go again.
the rest stop|joey|ii cant handle this, you guys.
the rest stop|chandler|yknow what, i can handle it, handles my middle name. actually its the ah, middle part of my first name.
the rest stop|ross|all right pheebs, your cabs ready.
the rest stop|rachel|all right, lets go
the rest stop|ross|youre welcome.
the rest stop|rachel|oh, im sorry, were you speaking to me or sleeping with someone else
the rest stop|ross|we were on a break
the rest stop|rachel|yknow ross why dont you put that on your answering machine
the rest stop|ross|heyhey, its valid okay and im not the only one who thinks so, monica agrees with me.
the rest stop|rachel|to monica what
the rest stop|monica|shyly i dont know.
the rest stop|ross|thats what you said last night.
the rest stop|monica|what i said was, was that i understood. joeys the one who agreed with you
the rest stop|ross|okay.
the rest stop|rachel|really joey
the rest stop|joey|pause what
the rest stop|phoebe|yknow what, but there is, there is no right or wrong, here.
the rest stop|rachel|no, i think its very obvious whos wrong here.
the rest stop|ross|obviously not to joey. [they all turn around and look at joey.]
the rest stop|joey|pause what [they all start fighting with each other.]
the rest stop|ross|to rachel look both, joey and monica feel the same way that i do. nononono.
the rest stop|chandler|guys, guys, guess who i am starts dancing around in an effort to stop the fighting. [they stop briefly to look at chandler, but then start fighting again.]
the rest stop|phoebe|hey hey hey hey hey they all stop fighting, chandler continues to dance. look what youre doing to chandler chandler finally stops to ross and rachel yeah, look, we know this is really, really hard for you guys. okay ross starts to leave you dont, all right you dont have to love each other, okay you dont, you dont even have to like each other much right now. but please, you have to figure out a way to be around each other.
the rest stop|joey|yeah, and not put us in the middle.
the rest stop|phoebe|yeah, otherwise, i mean thats, thats, thats just it for us hanging out together. yknow is that what you want they both look away can you be civil
the rest stop|rachel|yeah.
the rest stop|ross|i can.
the rest stop|phoebe|okay. good, all right, lets get back in the car, cause its freezing, and my chest is unsupported.
the rest stop|joey|oh what, wait, wait a second, i mean, what are we doing whos going with who
the rest stop|ross|look, you guys, you guys should go. joey tries to say something, but ross cuts him off. no, im, you, you planned this all out, and i dont want to ruin it, so you guys should just go.
the rest stop|joey|come on man, you drove all the way up here.
the rest stop|ross|no, no, really, ive got to take the car back anyway, im spending all day tomorrow with ben, its fine, no guilt i promise.
the rest stop|rachel|thank you.
the rest stop|monica|all right, well call you when we get back.
the rest stop|ross|okay.
the rest stop|phoebe|maybe we can like go to a movie or something. 
the rest stop|ross|okay.
the rest stop|phoebe|or, or the rodeo
the rest stop|ross|that would be great.
the rest stop|phoebe|okay
the rest stop|chandler|i was being shelly winters from the poseidon adventure.
the rest stop|ross|i know [they all get in the cab and drive away.]
carol and susans|phoebe|bye [ross tries to start the truck, and discovers the batterys dead.] closing credits
carol and susans|carol|looking through the peephole ugh. opening the door ross
carol and susans|ross|entering hi sorry im late. were you sleeping
carol and susans|carol|ahh, nooo
carol and susans|ross|oh, great listen, oh i had to get you a whole new battery. i got you the best one i could, cause thats not where you want to skimp.
carol and susans|carol|youre a genius, ross.
carol and susans|ross|yeah, well it came to about 112, but what the hell, just call it an even 110
carol and susans|carol|okay, ill pay you tomorrow. pushes him out the door
carol and susans|ross|okay.
carol and susans|carol|okay, bye
carol and susans|ross|so they ah, they all took off, it was pretty hard watching them go, yknow
carol and susans|carol|yeah, okay, bye. closes the door, turns out the lights, and runs back to the bedroom
