chandler and joeys|joey|hey, wouldnt be cool if our duck and chick had a little baby we could call it chuck.
chandler and joeys|chandler|or... dick.
chandler and joeys|ross|entering hey.
chandler and joeys|chandler and joey|hey.
chandler and joeys|ross|listen, ii need a favor. umm, i was in the shower, and as i was cleansing myself, i ah, ii, well i felt something.
chandler and joeys|chandler|was it like a sneeze only better
chandler and joeys|ross|no, no, i mean, i mean a thing on my body.
chandler and joeys|joey|with a disgusted look what was it
chandler and joeys|ross|well, i dont know, itsits kinda in a place thats not... its not visually accessible to me, and i was hoping maybe you guys couldcould help me out. starts to take off his pants
chandler and joeys|chandler and joey|whoa
chandler and joeys|chandler|no
chandler and joeys|ross|come on you guys, its no big deal he turns around and shows him his thing.
chandler and joeys|chandler|whoaheeeiiiiiiiiiiiah sees it huh.
chandler and joeys|ross|well what is it is it a mole he moves closer to them, and they jump back.
chandler and joeys|joey|no, its too wrinkly to be a mole.
chandler and joeys|ross|well, eww. what is it a pimple
chandler and joeys|chandler|no, its... fancier than a pimple. look ross, why dont you just go see a 
chandler and joeys|rachel|entering, interrupting them hey guys whats... sees what theyre doing and stops, the guys are stunned
chandler and joeys|chandler|okay, well, its definite, two more weeks of winter.
chandler and joeys|ross|ahhh.
central perk|joey|yeah, right. rachel backs out with a confused look on her face. opening credits date.]
central perk|phoebe|to her date okay, and then this is the coffee house. this is where i play my music. points to the stage
central perk|vince|good deal.
central perk|phoebe|yeah, and these are my friends. people. this is vince, vince the people.
central perk|rachel|hi
central perk|chandler|hey
central perk|vince|hey
central perk|phoebe|vince is a fireman.
central perk|rachel|wow have you ever rescued anyone from a burning building before
central perk|vince|98 hot saves, highest in the force.
central perk|chandler|well, yknow if joey and i played with matches we could get you up to an even hundred. 
central perk|vince|dead serious fire safety is not a joke, son.
central perk|chandler|youre right, i know.
central perk|vince|to phoebe look, i gotta go. im on call tonight. kisses her see you saturday. leaves
central perk|phoebe|okay. watches him leave
central perk|rachel|wow, hes cute, pheebs but i thought you just started dating that kindergarten teacher.
central perk|phoebe|oh, jason yeah, uhhuh, were seeing each other tonight.
central perk|rachel|whatpheebs two dates in one day thats so unlike you.
central perk|phoebe|i know, i know im like playing the field. yknow like, juggling two guys, im sowing my wild oats. yknow yknow, this kindve like yknow oatsowin, fieldplayin juggler.
central perk|joey|so pheebs, do they know about each other
central perk|phoebe|does a dogs lips move when he reads joey makes an i dont know face, and looks to chandler and rachel, whore also stumped okay, no they dont.
central perk|ross|entering hey guys
central perk|joey|hey.
central perk|rachel|hi he goes over and sits down at the counter, all depressed.
central perk|joey|going over to him well
central perk|chandler|joining them okay, howd it go at the doctors
central perk|ross|well, he said theres definitely nothing to worry about, its totally benign.
central perk|joey|well what is it
central perk|ross|he couldnt even tell me he said it was just some sort of skin... abnormality. and the worst thing is hehehe said, he said, without being able to identify it, he was reluctant to remove it.
central perk|chandler|yknow what you should go to my guy, because when i went in there with my third nipple. he just lopped it right off. yknow so i guess im lucky. i mean not as lucky as people who were born with two nipples.
central perk|ross|at least they knew what yours was. yknow, yours had a name.
central perk|joey|oh maybe theyll name yours after you yknow, theyll call it, the ross. and then people would be like, awww, hes got a ross.
central perk|ross|sarcastic yeah, thatd be cool [cut to phoebe and rachel as monica returns from the bathroom]
central perk|monica|petes breaking up with me.
central perk|all|what
central perk|monica|i just checked my messages, and he said that when he gets back from atlanta, we need to talk.
central perk|rachel|and
central perk|monica|well thats it. people never say we need to talk unless its something bad.
central perk|joey|whoa, that doesnt necessarily mean that hes breaking up with you.
central perk|monica|really
a street|joey|yeah, maybe he just cheated on you.
a street|jason|...and i know ill never miss doing it, but i gotta tell you, its pretty cool knowing that youre making a difference in a kids life.
a street|phoebe|that is so great oh, i... sees that a parked car near them has caught on fire oh my god
a street|jason|whoa
a street|phoebe|the fire has worsened oh my god
a street|jason|ahhahh, wed better call the fire department
a street|phoebe|stopping him no no 
a street|jason|no, no
a street|phoebe|well, we dont nnnnneed a fireman, wed, wed like a good mechanic. hears the sound of approaching sirens oh my god, here they come well, we gotta get out of here
a street|jason|wwwwait why
a doctors office|phoebe|well look, if i wanted to see a fireman, i would date one. okay she drags him away
a doctors office|ross|thththats all it is, a third nipple. yknow just your runofthemill third nipple. yknow you can take it off. just slice that baby right off
a doctors office|dr. rhodes|take your shirt off, and lets see what were dealing with here. ross starts to take off his pants what are you doing
a doctors office|ross|just showing you my runofthemillsliceitrightoff third nipple.
a doctors office|dr. rhodes|well thats not a third nipple.
a doctors office|ross|no
a doctors office|dr. rhodes|first of all, its on your ass.
a doctors office|ross|well then, what is it
a doctors office|dr. rhodes|wait a minute, hold it. he goes to the door and opens it. johnson will you come in here a moment
a doctors office|dr. johnson|im with hamilton
central perk|dr. rhodes|hes good with rear things, bring him in too.
central perk|monica|starting to get up i gotta go water petes plants. stops yknow what, if hes gonna break up with me, maybe i wont water his plants.
central perk|chandler|well, if hes gonna break up with you, maybe joey and i should water his plants. if yknow what i mean.
central perk|joey|or haha, we could go over there and pee on them.
central perk|phoebe|entering with rachel and ii cant take it yknow im just, always afraid one of them is gonna catch me with the other one. its making me crazy.
central perk|rachel|well honey, then why dont you break up with one of them
central perk|phoebe|disgusted uh.
central perk|joey|whoawhoawhoa. what ah, what happened to playing the field
central perk|phoebe|well, it just, it doesnt feel like playing anymore, it feels like work. its like im working in the field.
central perk|rachel|so pheebs, pick one of them.
central perk|monica|yeah. which one do you like more
central perk|phoebe|well, vince is great, yknow cause, hes like a guy, guy. yknow hes so burly, hes sooo very burly. giggles
central perk|joey|okay, good, so there you go. go with vince.
central perk|phoebe|yeah, but jasons really sensitive.
central perk|chandler|well sensitive is important, pick him.
central perk|phoebe|yeah.
central perk|joey|oh sure, go with the sissy.
central perk|phoebe|jason is not a sissy
dr|joey|oh nononono, i meant chandler. look at rosss thing. ross is none too pleased with the developments, he has a disgusted look on his face.]
dr|ross|yknow i have dinner plans
dr|dr. rhodes|thank you soo much for coming on such a short notice. ladies and gentlemen, iveiveive been practicing medicine for twentythree years, and im stumped.  he removes the blanket covering the thing.
petes apartment|all|whoa. they all lean in to get a closer look, ross isnt pleased around.]
petes apartment|monica|okay, this is the den. all right, check this out. lights the lights turn on automatically, but are very bright whoa all right. less lights bad lights lights go away they dim oh, see you just need to find the right command.
petes apartment|ross|yes, and the dimmer switch.
petes apartment|joey|whoa for a rich guy hes got, thats a pretty small tv.
petes apartment|monica|nonono, thats a videophone. but hey guys youre not supposed to be here, so please, do not touch anything.
petes apartment|chandler|sitting down on the couch ikea this is comfortable.
petes apartment|rachel|entering with phoebe this place is amazing.
petes apartment|phoebe|god, that is the nicest kitchen.
petes apartment|monica|i know.
petes apartment|phoebe|no but its the nicest kitchen, the refrigerator told me to have a great day.
petes apartment|joey|look at this a millionaires checkbook.
petes apartment|monica|joey, put that down the phone rings oh my god its pete. okay, get out how the hell do you answer a videophone steps in front of it, and automatically answers it
petes apartment|pete|monica the gang ducks and hides
petes apartment|monica|i guess thats how.
petes apartment|pete|hey monica, hows it going.
petes apartment|monica|oh its umm, good its umm, its good, just here watering the plants.
petes apartment|pete|well dont forget that fiches over there by rachel.
petes apartment|rachel|standing up ahh... chandlers on the couch
petes apartment|pete|i see him, you guys are just the worst hiders ever.
petes apartment|all|standing up hey pete.
petes apartment|joey|hi, how ya doing
petes apartment|monica|ahh, pete, the other day when you said you needed to talk, umm, just so i know, is it good news or bad news.
petes apartment|pete|oh, its good news. no, its definitely good news. hold on a second, i have another call. clicks his remote to his other call hey, hows it going
petes apartment|monica|oh nonono, its still me.
petes apartment|pete|ah, no its not. ive got pictureinpicture here. to other caller yeah. listens yeah, okay. im gonna have to call you back later. pause monica you. im gonna have to call you back.
petes apartment|monica|oh, oh, okay umm, so ill see you soon.
petes apartment|pete|okay, i love you.
petes apartment|monica|i love you.
petes apartment|all|i love you, love you.
petes apartment|monica|okay. well, its good news. its good news.
petes apartment|chandler|so, what do you thing the good news is
petes apartment|joey|looking at the checkbook wow look at this he wrote a check for 50,000 dollars to hugo ligrens ring design. monica is stunned oh, sorry, what do you think the good news is [pause]
petes apartment|monica|oh my.
petes apartment|rachel|monicas gonna marry a millionaire
petes apartment|ross|hey, you gotta get mom on the phone. call mom call mom petes computer automatically calls mom, petes mom.
petes apartment|petes mom|hello.
monica and rachels|monica|and thats petes mom.  the gang quickly hides again. commercial break
monica and rachels|rachel|mon you definitely have to make it a theme wedding, and the theme could be, look how much money weve got yknow, i mean you could put, you could put money inin the invitations youyou could have like little money place settings. and ah, you could start with a money salad i mean itll be dry, but people will like it.
monica and rachels|monica|would you stop weve only been going out a couple of weeks, i mean we dont even know if hes gonna propose.
monica and rachels|chandler|yes, but this is pete. okay hes not like other people, on your first date he took you to rome. for most guys thats like a third or fourth date kinda thing.
monica and rachels|monica|well ifif thats what it is, then itsits crazy.
monica and rachels|ross|monicas right. were talking about getting married here. okay sheshe cant just rush into this.
monica and rachels|rachel|oh please, what do you know you married a lesbian joey laughs, ross glares at him, and joey stops.
monica and rachels|phoebe|all right. i gotta go. i have break up with vince.
monica and rachels|chandler|oh, so youre going with the teacher, huh
monica and rachels|phoebe|yeah, i like vince a lot, yknow but, its just jasons so sensitive, yknow and in the long run, i think sensitive its just better than having just like a really, really, really nice pause butt. her eyes glaze over thinking about the butt. pause jason definitely jason okay, wish me luck
monica and rachels|all|good luck pause
a fire house|rachel|oh my god she holds her hands up in triumph and the gang all look at her. sorry, i was just imagining what itd be like to catch the money bouquet. 
a fire house|phoebe|excuse me. umm, is vince here
a fire house|fireman|oh sure. vince
a fire house|vince|yo slides down that pole that fire stations have
a fire house|phoebe|wow i didnt know you guys actually used those. 
a fire house|vince|so, whats up
a fire house|phoebe|umm, wow. thisthis isnt gonna be easy. umm, i dont think we should see each other anymore.
a fire house|vince|uhhuh. ggood deal.
a fire house|phoebe|im sorry.
a fire house|vince|nono its okay. its just that ah, i thought we had something pretty special here. and yknow ii felt like you were someone i could finally open up to, and starts choking up that theres so much in me i have to share with you yet.
a fire house|phoebe|oh my god, i didnt
a fire house|vince|starting to cry im sorry, i cant talk. im gonna go write in my journal. walks away
central perk|phoebe|running after him waitwaitwait wait
central perk|phoebe|to ross im telling you, if you want to take care of that thing, you should go to my herbal guy.
central perk|ross|thank you, but i want to remove it pheebs. i dont want to make it savory.
central perk|monica|yknow when girls sleep with guys with weird things on their body, they tell their friends about it.
central perk|ross|gimme this. grabs the herbalists card and leaves.
central perk|rachel|entering hi okay, dont be mad at me, but i couldnt resist.
central perk|monica|brides magazines
central perk|rachel|yes, and i know that youd say no if he asked you, but im sorry how great would you look walking down the aisle in this donna carin. shows her the picture.
central perk|phoebe|gasps oh, you so would oh, you should get that anyway. they both look at her. like for clubbing. 
central perk|monica|it is so weird, i know what i said, but uh, this morning, i was lying in bed i was, i was imagining what it would be like to say yes. rachel slams the magazine shut in amazement. i know its a little sudden, and its a little rushed, and its totally not like me to do something like this, but that doesnt mean i cant. right i mean imim crazy about pete, and i know that we want the same things, and when i thought about saying yes, it made me really happy.
central perk|rachel|oh my god. starting to cry 
central perk|monica|i know. pause i need more pie. goes and gets some
central perk|phoebe|hey mon umm, if you do get married, can i bring two guests
central perk|rachel|you didnt break up with that fireman
central perk|phoebe|no, that was my way of telling you. well, it turns out hes incredibly sensitive, he keeps a journal and he paints. he even showed me charcoal drawings that he drew of me.
central perk|rachel|wow
central perk|phoebe|yeah, well hed prefer water colors, but yknow, he has easy access to a lot of charcoal.
central perk|monica|so then, are you going to dump jason
jasons apartment|phoebe|well, yeah, because i have to break up with someone, and okay so jason is sensitive, holds up one finger but now sos vince holds up one finger on her other hand plus, vince has the body yknow holds up two more fingers on the vince side so its really just about the math.
jasons apartment|phoebe|knocks on the door jason
jasons apartment|jason|yeah, come on in. she goes in, and sees jason without his shirt. it turns out that he has a great body too, and is at a loss for words.
jasons apartment|jason|so phoebe, you ah, sounded kinda serious on the phone, is ah, is anything wrong
phoebes herbal guys office|phoebe|nahha looking around the exam room, and he goes over to a large bank of drawers, pulls one out and almost spills it as the herbalist, guru saj, enters.]
phoebes herbal guys office|guru saj|you must be ross.
phoebes herbal guys office|ross|hi.
phoebes herbal guys office|guru saj|i am guru saj. takes the drawer back and replaces
phoebes herbal guys office|ross|listen, i got to tell you iveive never been to a guru before, so...
phoebes herbal guys office|guru saj|well, relax. if it makes you feel better, ive attended some of the finest medical schools in central america. well then, lets take a look at this skin abnormality of yours. motions to the table come on, have a seat. looks at it eeh, huh. as i suspected, its a koondis
phoebes herbal guys office|ross|whats a koondis
phoebes herbal guys office|guru saj|i dont know, whats a koondis with you starts laughing as if that joke was funny, ross only looks at him, and he stops please, lie down ive got a sav that oughta shrink that right up.
phoebes herbal guys office|ross|i guess its worth a try.
phoebes herbal guys office|guru saj|oh sure, we should see resultswhoa clearly not the way to go quickly wipes it off
phoebes herbal guys office|ross|what what
phoebes herbal guys office|guru saj|we appear to have angered it.
phoebes herbal guys office|ross|we we angered it
phoebes herbal guys office|guru saj|oh, i think i see the problem. and im afraid were gonna have to use a much stronger tool. ross gives him a what look love.
phoebes herbal guys office|ross|oh god
phoebes herbal guys office|guru saj|he starts moving his hands around in circles above the thing. ross, there is absolutely no way this is going to come off unless you start to
phoebes herbal guys office|ross|ow 
phoebes herbal guys office|guru saj|oops.
phoebes herbal guys office|ross|what was, what was that
phoebes herbal guys office|guru saj|well its gone.
phoebes herbal guys office|ross|what hows that
phoebes herbal guys office|guru saj|it got caught on my watch.
petes apartment|ross|hey congratulates him
petes apartment|pete|lights. the lights turn on, once again theyre too bright. uh, romantic lights. the lights dim.
petes apartment|monica|ooh, nice.
petes apartment|pete|so ah, there was this thing i wanted to talk to you about.
petes apartment|monica|oh, right i completely forgot about that.
petes apartment|pete|well ah, ive been doing a lot of thinking, and i look at my life
petes apartment|monica|yeah
petes apartment|pete|and i feel like ive conquered the business world, and i feel like ive conquered the intellectual world, and now ii have the most beautiful woman in the world.
petes apartment|monica|wow.
petes apartment|pete|theres one thing missing.
petes apartment|monica|whats that
petes apartment|pete|its time for me to conquer the physical world.
petes apartment|monica|okay. not sure of herself
petes apartment|pete|monica, i want to become pause the ultimate fighting champion.
petes apartment|monica|you wanna what
petes apartment|pete|i want to become the ultimate fighting champion its the most intense physical competition in the world, its banned in 49 states
petes apartment|monica|what are you talking about
petes apartment|pete|okay, my trainer, ho chi, is teaching me a combination of gee koon doe and brazilian street fighting, ive even had my own octagon training ring designed.
petes apartment|monica|and i suppose you used a ring designer for that.
petes apartment|pete|yeah. monica, i want you there in the front row when i win. i want you close enough to smell the blood. what do you think
central perk|monica|my parents will be so happy.
central perk|phoebe|singing crazy underwear, creepin up my butt. jason enters crazy underwear, always in a rut. crazy undersees jasonwear in her head oh no what is he doing here all right, just keep playing, just keep playing. youll get through this youll be fine. she tries to continue the song, but she has lost the ability to pronounce words, and the lyrics come out as gibberish. giving up on the song okay, thank you. and, as always no one talk to me after the show. they all applaud her.
central perk|jason|going up to her hey. i was
central perk|phoebe|hey
central perk|jason|i was passin by and i saw that you were playing tonight, its kinda cool seeing you up there. kisses her
central perk|vince|running over whoa heyhey whats going on here who is this guy
central perk|phoebe|i dont know, he just started kissing me. get him get him, vince
central perk|vince|what
central perk|jason|what
central perk|phoebe|yeah, okay, iveive been dating both of you, and its been really horrible. cause yknow its been a lot of fun, for me. umm, but ii like you both, and i, and i didnt know how to chose, so... im sorry, im just, im terrible, im a terrible person. im terrible.
central perk|vince|phoebe, phoebe relax, its okay. i mean we never said this was exclusive.
central perk|jason|yeah, and neither did we. give yourself a break.
central perk|phoebe|really
central perk|jason|yeah. i mean yknow, we havent been going out that long. come on, we havent even slept together yet. huh.
central perk|vince|you havent
central perk|jason|you have
central perk|phoebe|well, this is none of my business. starts to walk away
central perk|jason|to phoebe ii cant believe this youyouve slept with him
central perk|phoebe|well, i made you a candle light dinner in the park.
central perk|jason|yknow phoebe, im gonna make this real easy for you. walks out
central perk|phoebe|to vince well, that couldve been really awkward.
central perk|vince|you made him a candle light dinner in the park
central perk|phoebe|yeah, but iiii can do that for you, im gonna do that for you.
guru sajs office: joey and chandler have taken the duck to see the guru|vince|uh yeah, i cant believe i ever went out with somebody who would actually have an open flame in the middle of a wooden area. walks out closing credits
guru sajs office: joey and chandler have taken the duck to see the guru|chandler|comforting the duck everythings gonna be all right. okay, dick
guru sajs office: joey and chandler have taken the duck to see the guru|guru saj|entering hello, i am guru sajsees the duckwhoa to joey thats supposed to be a duck right cause otherwise, this is waaay out of my league.
guru sajs office: joey and chandler have taken the duck to see the guru|joey|yeah, yeah. hes got a, hes got a really bad cough, and our vet, he cant do anything about it. is there something you can do
