the hospital|ross|shes not here yet. shes not here. shes having my baby and shes not here.
the hospital|monica|im sure everythings fine. has her water broke yet
the hospital|ross|i dont know, but when i spoke to her, she said she had already passed the mucus plug. joey makes a sound of absolute disgust.
the hospital|joey|do we have to know about that
the hospital|monica|joey, what are you gonna do when you have a baby
the hospital|joey|im gonna be in the waitin room, handing out cigars.
the hospital|chandler|yes, joeys made arrangements to have his baby in a movie from the 50s.
the hospital|ross|god, i dont believe this. she could be giving birth in the cab.
the hospital|rachel|oh, ross, relax. its probably like two dollars for the first contraction, and then fifty cents for each additional contraction. everyone looks at rachel as though she made a tasteless comment.
the hospital|rachel|what, its ok when chandler does it
the hospital|chandler|you have to pick your moments. phoebe arrives, guitar in hand.
the hospital|phoebe|did i miss it, did i miss it
the hospital|ross|shes not even here yet.
the hospital|monica|whats with the guitar
the hospital|phoebe|i just thought we might be here for awhile. you know, things might get musical. carol and susan arrive.
the hospital|ross|to carol where the hell have you been
the hospital|susan|we stopped at the gift shop.
the hospital|carol|i was looking at stuffed animals, and susan wanted a chunky.
the hospital|ross|susan wanted a chunky. were having a baby, ok, a baby, you dont stop for chunkys.
the hospital|chandler|i used to have that bumper sticker. everyone is amused by chandlers comment.
carols hospital room|chandler|to rachel you see what i mean. opening credits
carols hospital room|ross|stopped for a chunky.
carols hospital room|carol|let it go, ross.
carols hospital room|susan|i got an extra one. you want this holds the candy in front of ross face
carols hospital room|ross|weakly no. carols doctor, dr. franzblau arrives.
carols hospital room|dr. franzblau|hey, hows my favorite parenting team doing
carols hospital room|ross|dr. franzblau, hi.
carols hospital room|dr. franzblau|so, i understand youre thinking of having a baby well, i see youre nine months pregnant. thats a good start. how you doing with your contractions
carols hospital room|carol|oh, i love them. each ones like a little party in my uterus.
carols hospital room|susan|theyre every four minutes and last 55 seconds.
carols hospital room|ross|59 seconds. holds up his watch quartz, ha.
carols hospital room|susan|swiss quartz, ha, ha.
carols hospital room|carol|am i allowed to drink anything
carols hospital room|dr. franzblau|ice chips, just ice chips. theyre at the nurses station.
carols hospital room|ross|ill get it.
carols hospital room|susan|no, im getting it. ill be right back.
carols hospital room|ross|i got itim getting it they both leave just as rachel enters the room, holding a cup.
carols hospital room|rachel|hi, i thought you might like some ice chips.
carols hospital room|carol|thanks.
carols hospital room|rachel|and if you need anything else, inotices the handsome dr. franzblaudo not believe weve met. hi. im, uh, rachel green. im carols... exhusbands... sisters roommate. 
carols hospital room|dr. franzblau|it is nice to meet you. im dr. franzblau. im your roommates... brothers... exwifes obstetrician.
the waiting room|rachel|oh, thats funny
the waiting room|monica|i want a baby.
the waiting room|chandler|mmmm. not tonight, honey. i got an early day tomorrow.
the waiting room|monica|get up. come on. lets get some coffee.
the waiting room|chandler|oh, ok, cause we never do that. chandler and monica leave. cut to joey, watching the knicksceltics game on television.
the waiting room|joey|to the screen shoot shoot shoot shoot, or just fall down. thats good too. a young pregnant woman enters.
the waiting room|lydia|knick fan
the waiting room|joey|oh, yeah.
the waiting room|lydia|oh, boy, do they suck.
the waiting room|joey|hey, listen, lady....sees that shes pregnant...whoa.
the waiting room|lydia|look, look at your man, ewing. nice shot. you know what, he couldnt hit water if he was standing on a boat.
the waiting room|joey|oh yeah and who do you like
the waiting room|lydia|the celtics.
the waiting room|joey|the celtics ha. they couldnt hit a boat if...wait. they suck, alright
the waiting room|lydia|oh, shut up. you know, its a rebuilding year. you... waah
the waiting room|joey|wha wha..aa let me get the father. hey, we need a father over here we need a father
the waiting room|lydia|there is no father.
the waiting room|joey|oh, oh, oh, sorry.
the waiting room|lydia|ok, thats ok. im fine. im... oh
the waiting room|joey|oh, uh, ok. right this way. all the other pregnant women seem to be goin in here.
the waiting room|lydia|ok. joey accompanies lydia to a hospital room. there as well.]
the waiting room|phoebe|singing    theyre tiny and chubby and so sweet to touch,     and soon theyll grow up and resent you so much.      now theyre yelling at you and you dont know why,      you cry and you cry and you cry.      and you cry and you cry and you cry...   ross gives phoebe a dollar.
the waiting room|phoebe|thanks, ross.
the waiting room|ross|yeah. im paying you to stop.
the waiting room|phoebe|ok. a woman passes by, carrying newborn twins.
the waiting room|phoebe|oh, look, twins. hi, guys. oh, cute, cute.
the waiting room|monica|no fair. i dont even have one. how come they get two
the waiting room|chandler|youll get one.
the waiting room|monica|oh yeah when
the waiting room|chandler|all right. ill tell you what. when were 40, if neither one of us are married, what do you say you and i get together and have one
the waiting room|monica|why wont i be married when im 40
the waiting room|chandler|oh, no, no. i just meant hypothetically.
the waiting room|monica|ok, hypothetically, why wont i be married when im 40
the waiting room|chandler|no, no, no.
the waiting room|monica|what is it is there something fundamentally unmarriable about me
the waiting room|chandler|trapped uh, uh.
the waiting room|monica|well
the waiting room|chandler|dear god this parachute is a knapsack throws himself over the back of the chair he was sitting in rachel enters, in a formal dress.
the waiting room|rachel|hey.
the waiting room|phoebe|hey. ooh, look at you, dressydress.
the waiting room|monica|did you go home and change
the waiting room|rachel|yeah, well, its an important day. i wanna look nice. um, has uh dr. franzblau been by
the waiting room|monica|no, i havent seen him.
the waiting room|rachel|well, where is he he is supposed to be here. pause what if the baby needs him
the waiting room|chandler|rachel, what is the deal with you and doctors, anyway was, like, your father a doctor 
the waiting room|rachel|yeah, why
joey and lydia in the hospital room|chandler|no reason. turns around, makes an oh my god gesture with his eyes
joey and lydia in the hospital room|lydia|mom, weve been through this. no, im not calling him. i dont care if it is his kid, the guys a jerk. no, im not alone. joeys here. pause what do you mean, joey who covers the phone, to joey joey who
joey and lydia in the hospital room|joey|tribbiani.
joey and lydia in the hospital room|lydia|joey tribbiani. yes, ok. hold on. to joey she wants to talk to you. take the phone.
joey and lydia in the hospital room|joey|takes phone hi, yeah, its me. listens oh, no no no, were just friends. listens yeah, im single. listens 25. listens an actor. listens hello
joey and lydia in the hospital room|lydia|shes not much of a phone person.
joey and lydia in the hospital room|joey|yeah, so, uh, so, uh, whats the deal with this father guy, i mean, if someone was havin my baby somewhere, id wanna know about it, you know
joey and lydia in the hospital room|lydia|hey, knick fan, am i interested in your views on fatherhood uh, no. 
joey and lydia in the hospital room|joey|ok, look, maybe i should just go.
joey and lydia in the hospital room|lydia|maybe you should.
joey and lydia in the hospital room|joey|good luck, and uh, take care, huh  he leaves, but then returns a moment later.
joey and lydia in the hospital room|joey|you know what the celtics problem is they let the players run the team.
joey and lydia in the hospital room|lydia|oh, that is so not true.
joey and lydia in the hospital room|joey|oh, it is.
joey and lydia in the hospital room|lydia|it isnt.
joey and lydia in the hospital room|joey|it is.
carols hospital room|lydia|isnt
carols hospital room|ross|breathe.
carols hospital room|susan|breathe.
carols hospital room|ross|breathe.
carols hospital room|susan|breathe.
carols hospital room|ross|breathe.
carols hospital room|susan|breathe.
carols hospital room|carol|youre gonna kill me
carols hospital room|ross|15 more seconds, 14, 13, 12...
carols hospital room|carol|count faster.
carols hospital room|susan|its gonna be ok, just remember, were doing this for jordie. just keep focusing on jordie.
carols hospital room|ross|who the hell is jordie
carols hospital room|susan|your son.
carols hospital room|ross|nonono. i dont have a son named jordie. we all agreed, my sons name is jamie.
carols hospital room|carol|well, jamie was the name of susans first girlfriend, so we went back to jordie.
carols hospital room|ross|what whoa, whoa whoa whoa, what do you mean, back to jordie we never landed on jordie. we just passed by it during the whole jessy, cody, dylan fiasco.
carols hospital room|carol|ow, ow, ow, ow, leg cramp, leg cramp, leg cramp.
carols hospital room|ross|i got it.
carols hospital room|susan|i got it.
carols hospital room|ross|i got it hey, you get to sleep with her, i get the cramps.
carols hospital room|susan|no, you dont.
carols hospital room|carol|all right, thats it. i want both of you out.
carols hospital room|ross|why
carols hospital room|susan|he started it
carols hospital room|ross|no, you started it.
carols hospital room|susan|you did
carols hospital room|carol|i dont care. i am trying to get a person out of my body here, and youre not making it any easier.
carols hospital room|ross|but...
carols hospital room|carol|now go
carols hospital room|ross|to susan thanks a lot.
carols hospital room|susan|to ross see what you did.
carols hospital room|ross|to carol yeah, listen...
lydias hospital room|carol|out  ross and susan both angrily leave the hopsital room. present in her room as well.]
lydias hospital room|nurse|breathe, breathe, breathe...
lydias hospital room|lydia|oh, no. joey looks down at lydia.
lydias hospital room|joey|ew what is that something exploded
lydias hospital room|nurse|its just her water breaking. calm down, will you
lydias hospital room|joey|panicked water breaking, what do you mean whats that, water breaking
the hall|nurse|to joey breathe, breathe, breathe.
the hall|ross|please. this is so your fault.
the hall|susan|how, how is this my fault
the hall|ross|look, carol never threw me out of a room before you came along.
the hall|susan|yeah well, theres a lot of things carol never did before i came along.
the hall|ross|you tryin to be clever a funny lady
the hall|susan|you know what your problem is youre threatened by me.
the hall|ross|oh, im threatened by you
the hall|susan|yes. phoebe has heard them arguing and comes down the hall, taking them into a broom closet.
the hall|phoebe|hey, hey, ok, all right, thats it get in here. come on. my god, you guys, i dont believe you. there are children coming into the world in this very building and your negative fighting noises are not the first thing they should be hearing. so just stop all the yelling, just stop it
the hall|ross|yeah, susan.
the hall|phoebe|dont make me do this again, i dont like my voice like this. phoebe goes to leave the room, but the door is locked.
the broom closet|phoebe|ok, who wants to hear something ironic commercial break
the broom closet|all|help
carols room|ross|im having a baby in here ok, everyone stand back. walks backwards as if he is going to break down the door, but steps in a bucket and falls ow.
carols room|carol|are they here yet
carols room|rachel|no, honey, theyre not, but dont worry, because we are going to find them, and until we do, we are all here for you, ok
carols room|carol|ok.
carols room|rachel|ok
carols room|carol|ok.
carols room|rachel|to dr. franzblau ok, so anyway, you were telling me about paris, it sounds fascinating.
lydias room|dr. franzblau|it really was. there was this great little pastry shop right by my hotel. carol sits up in pain, rachel and dr. franzblau casually lay her back down there you go, dear. 
the broom closet|joey|come on, lydia, you can do it. push push em out, push em out, harder, harder. push em out, push em out, way out lets get that ball and really move, hey, hey, ho, ho. lets notices the nurse looking at him strangely i was justyeah, right. push push 
the broom closet|susan|whatre you gonna do, suck the door open
the broom closet|ross|help help
the broom closet|phoebe|singing they found their bodies the very next day, they found their bodies the very next...sees ross and susan staring at her la la la la la la.
the waiting room|susan and ross|even louder help behind her.]
the waiting room|monica|now, mom, everythings going fine, really. listens yeah, ross is great. hes uh, hes in a whole other place. listens no, hes gone. listens no no, you dont have to fly back, really. listens what do you mean this might be your only chance listens would you stop im only 26, im not even thinking about babies yet.  monica sees a woman pass by with a baby, puts the phone to her chest, and starts to cry. chandler takes the phone, makes a noise in it resembling static, and hangs up. joey enters.
the waiting room|chandler|where have you been
the waiting room|joey|oh, just had a baby.
the waiting room|chandler|mazel tov
the waiting room|dr. franzblau|i dont know, could be an hour, could be three, but relax, shes doing great. so, uh, tell me, are you currently involved with anyone
the waiting room|rachel|anxiously no, no, not at the moment, no, im not. are you
the waiting room|dr. franzblau|no, its hard enough to get women to go out with me.
the waiting room|rachel|right, yeah, ive heard that about cute doctors.
the waiting room|dr. franzblau|no, no, really. i suppose its because i spend so much time, you know, where i do.
the waiting room|rachel|oh.
the waiting room|dr. franzblau|i try not to let my work affect my personal life, but its hard, when you... do what i do. its like uh...well, for instance, what do you do
the waiting room|rachel|im a waitress.
the waiting room|dr. franzblau|ok, all right, well arent there times when you come home at the end of the day, and youre just like, if i see one more cup of coffee...
the waiting room|rachel|getting the point yeah. gotcha.
the waiting room|dr. franzblau|im gonna go check up on your friend.
the hall outside lydias room|rachel|ok. thats fine. takes her earrings out balloons, but before he enters he sees that the babys father has arrived. he listens at the door.]
the hall outside lydias room|lydia|so how did you know i was even here
the hall outside lydias room|guy|your mom called me. so is this her
the hall outside lydias room|lydia|no, this is a loaner.
the hall outside lydias room|guy|im sorry you had to do this by yourself.
the hall outside lydias room|lydia|i wasnt by myself. i had a doctor, a nurse, and a helper guy. joey smiles so, did you see who won the game
the hall outside lydias room|guy|yeah, the knicks by 10. they suck.
the broom closet|lydia|yeah, theyre not so bad. joey closes the door and ties the balloons to the knob. then he walks away, holding the hand of an inflated balloon animal he had brought. success.]
the broom closet|ross|come on, come on. damnit, damnit, damnit, damnit. to susan this is all your fault. this is supposed to be, like, the greatest day of my life, yknow my son is being born, and i should be in there, you know, instead of stuck in a closet with you.
the broom closet|susan|the woman i love is having a baby today. ive been waiting for this just as much as you have.
the broom closet|ross|no no no, believe me. no one has been waiting for this as much as i have, ok and you know what the funny thing is when this day is over, you get to go home with the baby, ok where does that leave me
the broom closet|susan|you get to be the babys father. everyone knows who you are. who am i theres mothers day, theres fathers day, theres no... lesbian lover day.
the broom closet|ross|every day is lesbian lover day.
the broom closet|phoebe|this is so great.
the broom closet|ross|you wanna explain that
carols room|phoebe|i mean, well, cause when i was growing up, you know my dad left, and my mother died, and my stepfather went to jail, so i barely had enough pieces of parents to make one whole one. and heres this little baby who has like three whole parents who care about it so much that theyre fighting over who gets to love it the most. and its not even born yet. its just, its just the luckiest baby in the whole world. pause im sorry, you were fighting. ross, and susan, who are in the broom closet.]
carols room|carol|where are they
carols room|monica|im sure theyll be here soon.
carols room|rachel|yeah, honey, they wouldnt miss this.
carols room|joey|relax. youre only at nine centimeters. and the babys at zero station.
carols room|chandler|to joey you are really frightening me. carol suddenly screams in pain and grabs chandler by the shirt.
carols room|chandler|somebody wanna help me, tryin to rip out my heart. they pull her hand off of him uh, thats great. looking around anybody seen a nipple
carols room|dr. franzblau|all right, ten centimeters, here we go.
carols room|nurse|all right, honey, time to start pushing.
carols room|carol|but theyre not here yet
carols room|dr. franzblau|im sorry, i cant tell the baby to wait for them.
the broom closet|carol|oh, god. phoebe is wearing a janitors uniform, ready to go up in the vent.]
the broom closet|ross|ok, got the vent open.
the broom closet|phoebe|reading the nametag on the uniform hi, im ben. im hospital worker ben. its ben... to the rescue
the broom closet|ross|ben, you ready all right, gimme your foot. ok, on three, ben. one, two, three. ok, thats it, ben. ross and susan lift phoebe up into the vent.
the broom closet|susan|what do you see
the broom closet|phoebe|well, susan, i see what appears to be a dark vent. wait. yes, it is in fact a dark vent. a janitor opens the closet door from the outside.
the broom closet|ross|phoebs, its open its open ross and susan run to the delivery room, leaving phoebe dangling from the vent.
carols room|janitor|to ross and susan wait you forgot your legs
carols room|all|push, push
carols room|ross|were here
carols room|carol|irked where have you been
carols room|ross|long story, honey.
carols room|dr. franzblau|all right, carol, i need you to keep pushing. i needreaches for an instrument, rachels hand is on it excuse me, could i have this
carols room|nurse|all right, all right, theres a few too many people in this room, and theres about to be one more, so anybody whos not an exhusband or a lesbian life partner, out you go
carols room|all|good luck everyone heads for the door.
carols room|chandler|to nurse let me ask you, do you have to be carols lesbian life partner
carols room|nurse|out
carols room|dr. franzblau|all right, hes crowning. here he comes.
carols room|ross|let me see, i gotta see, i gotta see. oh, a head. oh, its, its huge. carol, how are you doing this
carols room|carol|straining not.... helping
carols room|dr. franzblau|youre doing great, youre doing fine. 
carols room|ross|puts his head near the baby hello to dr. franzblau oh, sorry.
carols room|susan|what do you see what do you see
carols room|ross|we got a head, we got shoulders, we got arms, we got, oh, look at the little fingers, oh, and a chest, and a stomach. its a boy, definitely a boy all right ok, legs, knees, and feet. oh, oh. hes here. hes a person.
carols room|susan|oh, look at that.
carols room|carol|what does he look like
carols room|ross|kinda like my uncle ed, covered in jello.
carols room|carol|really
carols room|phoebe|from the air vent overhead you guys, hes beautiful
the delivery room|ross|oh, thanks, pheebs they look up towards the vent and wave at phoebe.
the delivery room|susan|no shouting, but we still need a name for this little guy.
the delivery room|ross|thinking how bout ben
the delivery room|susan|i like ben.
the delivery room|carol|ben. ben. bens good. how come you never mentioned ben before
the delivery room|ross|we uh, we just cooked it up.
the delivery room|susan|thats what we were off doing. monica opens the door.
the delivery room|monica|hi.
the delivery room|ross|hey.
the delivery room|monica|can we come in the whole gang enters.
the delivery room|ross|to ben i know, i know. everybody, theres someone id like you to meet. yeah. this is ben. ben, this is everybody.
the delivery room|phoebe|susan, he looks just like you.
the delivery room|susan|thanks.
the delivery room|rachel|oh, god, i cant believe one of us actually has one of these.
the delivery room|chandler|i know, i still am one of these.
the delivery room|monica|ross, can i monica holds ben.
the delivery room|ross|the head, the head. you gotta...
the hospital|monica|getting choked up hi, ben. hi. im your aunt monica. yes i am. im your aunt monica. i...i will always have gum. closing credits
the hospital|ross|ben, i want you to know that there may be some times when i may not be around, like this. walks out of the picture but ill still always come back, like this. returns and sometimes i may be away longer, like this. walks away but ill still always come back, like this. returns  chandler comes into the picture.
the hospital|chandler|and sometimes, ill want you to steal third, and ill go like this. does a baseball sign. the rest of the group come into the picture.
the hospital|monica|he is so amazing.
the hospital|rachel|oh, i know. look at him.
the hospital|joey|ben, ben, hey ben. nothing. i dont think thats his name.
the hospital|phoebe|oh, look, look, hes closing his eyes. screen goes blank look, hes opening his eyes. picture comes back 
the hospital|joey|he doesnt do much, does he
the hospital|ross|no, this is pretty much it. long moment of silence
the hospital|rachel|you guys wanna get some coffee
the hospital|all|yeah.
the hospital|ross|all right, ill see you guys later. they all leave but ross, but they all come back a few seconds later. they make faces at the baby.
